,Source(T/F),Answer(T/F),Question,Answer,Source,Note,Context_1,Context_2,Context_3,Context_4
8,,,What precautions should be taken while handling the product?,"Wear rubber gloves, chemical splash goggles and protective outerwear when handling. Avoid breathing of vapors or mists. Use in well-ventilated area. Keep out of reach of children. For use by trained personnel only.",SECTION 7-HEALTH HAZARDS AND FIRST AID,,"contact. Avoid contact with eyes, skin and clothing. Wear rubber gloves, chemical splash goggles and protective outerwear wh en handling. Avoid breathing of vapors or mists. Use in well- ventilated area. Keep out of r each of children. For use by trained personnel only. Keep container closed during stor age. For institutional and industrial use only. SECTION 7-HEALTH HAZARDS AND FIRST AID SECTION 8-SPECIAL PROTECTION INFORMATION Effects of Overexposure: Skin: M oderate skin irritant. Prolonged or repeated contact may cause redness, dermatitis . Eyes: Ey e irritant. Liquid and mists will cause tearing, redness, burning sensation. Inhalation: V apors and mists may be irritating to mucous membranes in the nose, throat, and lungs. Ingestion: Irrita ting to the mouth and throat. May cause headache, nausea, abdominal pain, vomiting, and diarrhea. Excessive amounts may cause collapse. Respiratory Protection: Use in well ventilated area. Ventilation Requirements: Pr ovide local exhaust to keep TLV of Section 2 in- gredients below acceptable limit. Protective Gloves: Chem ical resistant rubber or neoprene. Eye Protection: Safety glasses or chemical splash goggles. Other Protective Equipment: Wear protective rubber footwear when using on floor . Wear protective outerwear when danger of mist contact may occur . First Aid Procedures: SECTION 9-SPILL OR LEAK PROCEDURES Skin: Flush with water. Seek medical attention if irritation persists. Eyes: Immediately flush with large quantities of","Protection: Use in well ventilated area. Ventilation Requirements: Pr ovide local exhaust to keep TLV of Section 2 in- gredients below acceptable limit. Protective Gloves: Chem ical resistant rubber or neoprene. Eye Protection: Safety glasses or chemical splash goggles. Other Protective Equipment: Wear protective rubber footwear when using on floor . Wear protective outerwear when danger of mist contact may occur . First Aid Procedures: SECTION 9-SPILL OR LEAK PROCEDURES Skin: Flush with water. Seek medical attention if irritation persists. Eyes: Immediately flush with large quantities of water, holding eyelids open. Seek m edical attention if irritation persists. Inhalation: Get to fresh air. Seek m edical attention if irritation persists. Ingestion: Do not induce vom iting. Drink large quantities of water. Seek medical attention immediately. Steps to be taken in Case Material is Released or Spilled: Floors will becom e slippery. Avoid walking in product. K eep unessential personnel away. Mop up or otherwise absorb and hold disposal. Avoi d discharge to sewer or open waterways. Waste Disposal Method: Any method in accordance with local, state and federal laws. Best method is to recycle or reuse for intended purpose. Consult local authorities for disposal in public sewer. Do not dispose of into storm drain, stream, river or to ground. Rinse container thoroughly before discarding in trash. SECTION 10-REGULATORY INFORMATION SARA Title III - Section 311/312 -Hazard Categories:","If medical advice is needed, have product container or label at hand. Keep out of reach of children. Read label before use. Keep away from flames and hot surfaces. – No smoking. Avoid breathing dust/fume/gas/mist/vapors/spray Wear protective gloves / eye protection / face protection. Wear protective gloves. Wear eye protection / face protection. Wash thoroughly after handling. Use only outdoors or in a well-ventilated area. If in eyes: Rinse cautiously with water for several minutes. Remove contact lenses, if present and easy to do. Continue rinsing. Specific treatment (see on this label). IF INHALED: Remove victim to fresh air and keep at rest in a position comfortable for breathing. Call a poison center/doctor if you feel unwell. If skin irritation occurs: Get medical advice/attention. If eye irritation persists: Get medical advice/attention. In case of fire: Use for extinction: CO2, powder or water spray. If on skin: Wash with plenty of water. Take off contaminated clothing and wash it before reuse. Store locked up. Store in a well-ventilated place. Keep container tightly closed. Store in a well-ventilated place. Keep cool. Dispose of contents/container in accordance with local/regional/national/international regulations. · Other hazards · Results of PBT and vPvB assessment · PBT: Not applicable. · vPvB: Not applicable. * 3 Composition/information on ingredients · Chemical characterization: Mixtures · Description: Mixture of the substances listed below with nonhazardous","statements If medical advice is needed, have product container or label at hand. Keep out of reach of children. Read label before use. Keep away from flames and hot surfaces. – No smoking. Avoid breathing dust/fume/gas/mist/vapors/spray Wear protective gloves / eye protection / face protection. Wear protective gloves. Wear eye protection / face protection. Wash thoroughly after handling. Use only outdoors or in a well-ventilated area. If in eyes: Rinse cautiously with water for several minutes. Remove contact lenses, if present and easy to do. Continue rinsing. Specific treatment (see on this label). IF INHALED: Remove victim to fresh air and keep at rest in a position comfortable for breathing. Call a poison center/doctor if you feel unwell. If skin irritation occurs: Get medical advice/attention. If eye irritation persists: Get medical advice/attention. In case of fire: Use for extinction: CO2, powder or water spray. If on skin: Wash with plenty of water. Take off contaminated clothing and wash it before reuse. Store locked up. Store in a well-ventilated place. Keep container tightly closed. Store in a well-ventilated place. Keep cool. Dispose of contents/container in accordance with local/regional/national/international regulations. · Chemical safety assessment: A Chemical Safety Assessment has not been carried out. * 16Other information This information is based on our present knowledge. However, this shall not constitute a guarantee for any specific product features and"
9,,,What are the first aid measures in case of inhalation?,Supply fresh air; consult doctor in case of complaints.,4 First-aid measures,,"skin contact: Immediately wash with water and soap and rinse thoroughly. · After eye contact: Rinse opened eye for several minutes under running water. Then consult a doctor. · After swallowing: Call a doctor immediately. · Information for doctor: · Most important symptoms and effects, both acute and delayed Breathing difficulty · Indication of any immediate medical attention and s pecial treatment needed No further relevant information available. 5 Fire-fighting measures · Extinguishing media · Suitable extinguishing agents: CO2, extinguishing powder or water spray. Fight larger fires with water spray or alcohol resistant foam. · For safety reasons unsuitable extinguishing agents: Water with full jet · Special hazards arising from the substance or mixtu reNitrogen oxides (NOx) · Advice for firefighters · Protective equipment: Wear self-contained respiratory protective device. (Contd. on page 3)Page 3/7 Safety Data Sheet acc. to OSHA HCS Printing date 06/04/2015 Reviewed on 06/04/2015 Trade name:H1 (Contd. of page 2) 40.1.36 Accidental release measures · Personal precautions, protective equipment and emerg ency procedures Ensure adequate ventilation · Environmental precautions: Do not allow product to reach sewage system or any water course. · Methods and material for containment and cleaning u p: Allow to solidify. Pick up mechanically. Ensure adequate ventilation. Do not use cotton or natural fiber cloths for clean up · Reference to other sections See Section 7 for","contact. Avoid contact with eyes, skin and clothing. Wear rubber gloves, chemical splash goggles and protective outerwear wh en handling. Avoid breathing of vapors or mists. Use in well- ventilated area. Keep out of r each of children. For use by trained personnel only. Keep container closed during stor age. For institutional and industrial use only. SECTION 7-HEALTH HAZARDS AND FIRST AID SECTION 8-SPECIAL PROTECTION INFORMATION Effects of Overexposure: Skin: M oderate skin irritant. Prolonged or repeated contact may cause redness, dermatitis . Eyes: Ey e irritant. Liquid and mists will cause tearing, redness, burning sensation. Inhalation: V apors and mists may be irritating to mucous membranes in the nose, throat, and lungs. Ingestion: Irrita ting to the mouth and throat. May cause headache, nausea, abdominal pain, vomiting, and diarrhea. Excessive amounts may cause collapse. Respiratory Protection: Use in well ventilated area. Ventilation Requirements: Pr ovide local exhaust to keep TLV of Section 2 in- gredients below acceptable limit. Protective Gloves: Chem ical resistant rubber or neoprene. Eye Protection: Safety glasses or chemical splash goggles. Other Protective Equipment: Wear protective rubber footwear when using on floor . Wear protective outerwear when danger of mist contact may occur . First Aid Procedures: SECTION 9-SPILL OR LEAK PROCEDURES Skin: Flush with water. Seek medical attention if irritation persists. Eyes: Immediately flush with large quantities of","powder or water spray. If on skin: Wash with plenty of water. Take off contaminated clothing and wash it before reuse. Store locked up. Store in a well-ventilated place. Keep container tightly closed. Store in a well-ventilated place. Keep cool. Dispose of contents/container in accordance with local/regional/national/international regulations. · Other hazards · Results of PBT and vPvB assessment · PBT: Not applicable. · vPvB: Not applicable. * 3 Composition/information on ingredients · Chemical characterization: Mixtures · Description: Mixture of the substances listed below with nonhazardous additions. · Dangerous components: 7085-85-0 ethyl 2-cyanoacrylate 50-100% 142-16-5 Bis(2-ethylheyxl)maleate 0.1-<0.25% 123-31-9 1,4-dihydroxybenzene <0.1% * 4 First-aid measures · Description of first aid measures · After inhalation: Supply fresh air; consult doctor in case of complaints. · After skin contact: Immediately wash with water and soap and rinse thoroughly. · After eye contact: Rinse opened eye for several minutes under running water. Then consult a doctor. · After swallowing: Call a doctor immediately. · Information for doctor: · Most important symptoms and effects, both acute and delayed Breathing difficulty · Indication of any immediate medical attention and s pecial treatment needed No further relevant information available. 5 Fire-fighting measures · Extinguishing media · Suitable extinguishing agents: CO2, extinguishing powder or water spray. Fight larger fires with","Protection: Use in well ventilated area. Ventilation Requirements: Pr ovide local exhaust to keep TLV of Section 2 in- gredients below acceptable limit. Protective Gloves: Chem ical resistant rubber or neoprene. Eye Protection: Safety glasses or chemical splash goggles. Other Protective Equipment: Wear protective rubber footwear when using on floor . Wear protective outerwear when danger of mist contact may occur . First Aid Procedures: SECTION 9-SPILL OR LEAK PROCEDURES Skin: Flush with water. Seek medical attention if irritation persists. Eyes: Immediately flush with large quantities of water, holding eyelids open. Seek m edical attention if irritation persists. Inhalation: Get to fresh air. Seek m edical attention if irritation persists. Ingestion: Do not induce vom iting. Drink large quantities of water. Seek medical attention immediately. Steps to be taken in Case Material is Released or Spilled: Floors will becom e slippery. Avoid walking in product. K eep unessential personnel away. Mop up or otherwise absorb and hold disposal. Avoi d discharge to sewer or open waterways. Waste Disposal Method: Any method in accordance with local, state and federal laws. Best method is to recycle or reuse for intended purpose. Consult local authorities for disposal in public sewer. Do not dispose of into storm drain, stream, river or to ground. Rinse container thoroughly before discarding in trash. SECTION 10-REGULATORY INFORMATION SARA Title III - Section 311/312 -Hazard Categories:"
10,,,What are the first aid measures in case of skin contact?,Immediately wash with water and soap and rinse thoroughly.,4 First-aid measures,,"contact. Avoid contact with eyes, skin and clothing. Wear rubber gloves, chemical splash goggles and protective outerwear wh en handling. Avoid breathing of vapors or mists. Use in well- ventilated area. Keep out of r each of children. For use by trained personnel only. Keep container closed during stor age. For institutional and industrial use only. SECTION 7-HEALTH HAZARDS AND FIRST AID SECTION 8-SPECIAL PROTECTION INFORMATION Effects of Overexposure: Skin: M oderate skin irritant. Prolonged or repeated contact may cause redness, dermatitis . Eyes: Ey e irritant. Liquid and mists will cause tearing, redness, burning sensation. Inhalation: V apors and mists may be irritating to mucous membranes in the nose, throat, and lungs. Ingestion: Irrita ting to the mouth and throat. May cause headache, nausea, abdominal pain, vomiting, and diarrhea. Excessive amounts may cause collapse. Respiratory Protection: Use in well ventilated area. Ventilation Requirements: Pr ovide local exhaust to keep TLV of Section 2 in- gredients below acceptable limit. Protective Gloves: Chem ical resistant rubber or neoprene. Eye Protection: Safety glasses or chemical splash goggles. Other Protective Equipment: Wear protective rubber footwear when using on floor . Wear protective outerwear when danger of mist contact may occur . First Aid Procedures: SECTION 9-SPILL OR LEAK PROCEDURES Skin: Flush with water. Seek medical attention if irritation persists. Eyes: Immediately flush with large quantities of","skin contact: Immediately wash with water and soap and rinse thoroughly. · After eye contact: Rinse opened eye for several minutes under running water. Then consult a doctor. · After swallowing: Call a doctor immediately. · Information for doctor: · Most important symptoms and effects, both acute and delayed Breathing difficulty · Indication of any immediate medical attention and s pecial treatment needed No further relevant information available. 5 Fire-fighting measures · Extinguishing media · Suitable extinguishing agents: CO2, extinguishing powder or water spray. Fight larger fires with water spray or alcohol resistant foam. · For safety reasons unsuitable extinguishing agents: Water with full jet · Special hazards arising from the substance or mixtu reNitrogen oxides (NOx) · Advice for firefighters · Protective equipment: Wear self-contained respiratory protective device. (Contd. on page 3)Page 3/7 Safety Data Sheet acc. to OSHA HCS Printing date 06/04/2015 Reviewed on 06/04/2015 Trade name:H1 (Contd. of page 2) 40.1.36 Accidental release measures · Personal precautions, protective equipment and emerg ency procedures Ensure adequate ventilation · Environmental precautions: Do not allow product to reach sewage system or any water course. · Methods and material for containment and cleaning u p: Allow to solidify. Pick up mechanically. Ensure adequate ventilation. Do not use cotton or natural fiber cloths for clean up · Reference to other sections See Section 7 for","Protection: Use in well ventilated area. Ventilation Requirements: Pr ovide local exhaust to keep TLV of Section 2 in- gredients below acceptable limit. Protective Gloves: Chem ical resistant rubber or neoprene. Eye Protection: Safety glasses or chemical splash goggles. Other Protective Equipment: Wear protective rubber footwear when using on floor . Wear protective outerwear when danger of mist contact may occur . First Aid Procedures: SECTION 9-SPILL OR LEAK PROCEDURES Skin: Flush with water. Seek medical attention if irritation persists. Eyes: Immediately flush with large quantities of water, holding eyelids open. Seek m edical attention if irritation persists. Inhalation: Get to fresh air. Seek m edical attention if irritation persists. Ingestion: Do not induce vom iting. Drink large quantities of water. Seek medical attention immediately. Steps to be taken in Case Material is Released or Spilled: Floors will becom e slippery. Avoid walking in product. K eep unessential personnel away. Mop up or otherwise absorb and hold disposal. Avoi d discharge to sewer or open waterways. Waste Disposal Method: Any method in accordance with local, state and federal laws. Best method is to recycle or reuse for intended purpose. Consult local authorities for disposal in public sewer. Do not dispose of into storm drain, stream, river or to ground. Rinse container thoroughly before discarding in trash. SECTION 10-REGULATORY INFORMATION SARA Title III - Section 311/312 -Hazard Categories:","powder or water spray. If on skin: Wash with plenty of water. Take off contaminated clothing and wash it before reuse. Store locked up. Store in a well-ventilated place. Keep container tightly closed. Store in a well-ventilated place. Keep cool. Dispose of contents/container in accordance with local/regional/national/international regulations. · Other hazards · Results of PBT and vPvB assessment · PBT: Not applicable. · vPvB: Not applicable. * 3 Composition/information on ingredients · Chemical characterization: Mixtures · Description: Mixture of the substances listed below with nonhazardous additions. · Dangerous components: 7085-85-0 ethyl 2-cyanoacrylate 50-100% 142-16-5 Bis(2-ethylheyxl)maleate 0.1-<0.25% 123-31-9 1,4-dihydroxybenzene <0.1% * 4 First-aid measures · Description of first aid measures · After inhalation: Supply fresh air; consult doctor in case of complaints. · After skin contact: Immediately wash with water and soap and rinse thoroughly. · After eye contact: Rinse opened eye for several minutes under running water. Then consult a doctor. · After swallowing: Call a doctor immediately. · Information for doctor: · Most important symptoms and effects, both acute and delayed Breathing difficulty · Indication of any immediate medical attention and s pecial treatment needed No further relevant information available. 5 Fire-fighting measures · Extinguishing media · Suitable extinguishing agents: CO2, extinguishing powder or water spray. Fight larger fires with"
11,,,What are the first aid measures in case of eye contact?,Rinse opened eye for several minutes under running water. Then consult a doctor.,4 First-aid measures,,"contact. Avoid contact with eyes, skin and clothing. Wear rubber gloves, chemical splash goggles and protective outerwear wh en handling. Avoid breathing of vapors or mists. Use in well- ventilated area. Keep out of r each of children. For use by trained personnel only. Keep container closed during stor age. For institutional and industrial use only. SECTION 7-HEALTH HAZARDS AND FIRST AID SECTION 8-SPECIAL PROTECTION INFORMATION Effects of Overexposure: Skin: M oderate skin irritant. Prolonged or repeated contact may cause redness, dermatitis . Eyes: Ey e irritant. Liquid and mists will cause tearing, redness, burning sensation. Inhalation: V apors and mists may be irritating to mucous membranes in the nose, throat, and lungs. Ingestion: Irrita ting to the mouth and throat. May cause headache, nausea, abdominal pain, vomiting, and diarrhea. Excessive amounts may cause collapse. Respiratory Protection: Use in well ventilated area. Ventilation Requirements: Pr ovide local exhaust to keep TLV of Section 2 in- gredients below acceptable limit. Protective Gloves: Chem ical resistant rubber or neoprene. Eye Protection: Safety glasses or chemical splash goggles. Other Protective Equipment: Wear protective rubber footwear when using on floor . Wear protective outerwear when danger of mist contact may occur . First Aid Procedures: SECTION 9-SPILL OR LEAK PROCEDURES Skin: Flush with water. Seek medical attention if irritation persists. Eyes: Immediately flush with large quantities of","skin contact: Immediately wash with water and soap and rinse thoroughly. · After eye contact: Rinse opened eye for several minutes under running water. Then consult a doctor. · After swallowing: Call a doctor immediately. · Information for doctor: · Most important symptoms and effects, both acute and delayed Breathing difficulty · Indication of any immediate medical attention and s pecial treatment needed No further relevant information available. 5 Fire-fighting measures · Extinguishing media · Suitable extinguishing agents: CO2, extinguishing powder or water spray. Fight larger fires with water spray or alcohol resistant foam. · For safety reasons unsuitable extinguishing agents: Water with full jet · Special hazards arising from the substance or mixtu reNitrogen oxides (NOx) · Advice for firefighters · Protective equipment: Wear self-contained respiratory protective device. (Contd. on page 3)Page 3/7 Safety Data Sheet acc. to OSHA HCS Printing date 06/04/2015 Reviewed on 06/04/2015 Trade name:H1 (Contd. of page 2) 40.1.36 Accidental release measures · Personal precautions, protective equipment and emerg ency procedures Ensure adequate ventilation · Environmental precautions: Do not allow product to reach sewage system or any water course. · Methods and material for containment and cleaning u p: Allow to solidify. Pick up mechanically. Ensure adequate ventilation. Do not use cotton or natural fiber cloths for clean up · Reference to other sections See Section 7 for","If medical advice is needed, have product container or label at hand. Keep out of reach of children. Read label before use. Keep away from flames and hot surfaces. – No smoking. Avoid breathing dust/fume/gas/mist/vapors/spray Wear protective gloves / eye protection / face protection. Wear protective gloves. Wear eye protection / face protection. Wash thoroughly after handling. Use only outdoors or in a well-ventilated area. If in eyes: Rinse cautiously with water for several minutes. Remove contact lenses, if present and easy to do. Continue rinsing. Specific treatment (see on this label). IF INHALED: Remove victim to fresh air and keep at rest in a position comfortable for breathing. Call a poison center/doctor if you feel unwell. If skin irritation occurs: Get medical advice/attention. If eye irritation persists: Get medical advice/attention. In case of fire: Use for extinction: CO2, powder or water spray. If on skin: Wash with plenty of water. Take off contaminated clothing and wash it before reuse. Store locked up. Store in a well-ventilated place. Keep container tightly closed. Store in a well-ventilated place. Keep cool. Dispose of contents/container in accordance with local/regional/national/international regulations. · Other hazards · Results of PBT and vPvB assessment · PBT: Not applicable. · vPvB: Not applicable. * 3 Composition/information on ingredients · Chemical characterization: Mixtures · Description: Mixture of the substances listed below with nonhazardous","powder or water spray. If on skin: Wash with plenty of water. Take off contaminated clothing and wash it before reuse. Store locked up. Store in a well-ventilated place. Keep container tightly closed. Store in a well-ventilated place. Keep cool. Dispose of contents/container in accordance with local/regional/national/international regulations. · Other hazards · Results of PBT and vPvB assessment · PBT: Not applicable. · vPvB: Not applicable. * 3 Composition/information on ingredients · Chemical characterization: Mixtures · Description: Mixture of the substances listed below with nonhazardous additions. · Dangerous components: 7085-85-0 ethyl 2-cyanoacrylate 50-100% 142-16-5 Bis(2-ethylheyxl)maleate 0.1-<0.25% 123-31-9 1,4-dihydroxybenzene <0.1% * 4 First-aid measures · Description of first aid measures · After inhalation: Supply fresh air; consult doctor in case of complaints. · After skin contact: Immediately wash with water and soap and rinse thoroughly. · After eye contact: Rinse opened eye for several minutes under running water. Then consult a doctor. · After swallowing: Call a doctor immediately. · Information for doctor: · Most important symptoms and effects, both acute and delayed Breathing difficulty · Indication of any immediate medical attention and s pecial treatment needed No further relevant information available. 5 Fire-fighting measures · Extinguishing media · Suitable extinguishing agents: CO2, extinguishing powder or water spray. Fight larger fires with"
