,Source(T/F),Answer(T/F),Question,Answer,Source,Note,Context_1,Context_2,Context_3,Context_4
19,,,What are the physical and chemical properties of the product?,Appearance: Form: Liquid Color: According to product specification; Odor: Characteristic; Odour threshold: Not determined.; pH-value: Not determined.; Melting point/Melting range: Undetermined.; Boiling point/Boiling range: > 150 °C (> 302 °F); Flash point: 87 °C (189 °F); Vapor pressure at 20 °C (68 °F): 0.27 hPa; Density at 20 °C (68 °F): 1.05 g/cm³ (8.762 lbs/gal); Bulk density at 20 °C (68 °F): 1.05 kg/m³,40.1.3 · Physical and chemical properties,,"and has to be observed. (Contd. on page 4)Page 4/7 Safety Data Sheet acc. to OSHA HCS Printing date 06/04/2015 Reviewed on 06/04/2015 Trade name:H1 (Contd. of page 3) 40.1.3· Not suitable are gloves made of the following materi als: Cotton or natural fibers PVC gloves · Eye protection: Safety glasses `RTightly sealed goggles · Body protection: Protective work clothing 9 Physical and chemical properties · Information on basic physical and chemical properti es · General Information · Appearance: Form: Liquid Color: According to product specification · Odor: Characteristic · Odour threshold: Not determined. · pH-value: Not determined. · Change in condition Melting point/Melting range: Undetermined. Boiling point/Boiling range: > 150 °C (> 302 °F) · Flash point: 87 °C (189 °F) · Flammability (solid, gaseous): Not applicable. · Ignition temperature: Decomposition temperature: Not determined. · Auto igniting: Product is not selfigniting. · Danger of explosion: Not determined. · Explosion limits: Lower: Not determined. Upper: Not determined. · Vapor pressure at 20 °C (68 °F): 0.27 hPa · Density at 20 °C (68 °F): 1.05 g/cm³ (8.762 lbs/gal) · Bulk density at 20 °C (68 °F): 1.05 kg/m³ · Relative density Not determined. · Vapour density Not determined. · Evaporation rate Not determined. · Solubility in / Miscibility with Water: Not miscible or difficult to mix. · Partition coefficient (n-octanol/water): Not determined. · Viscosity: Dynamic: Not determined. Kinematic: Not determined. ·","· Auto igniting: Product is not selfigniting. · Danger of explosion: Not determined. · Explosion limits: Lower: Not determined. Upper: Not determined. · Vapor pressure at 20 °C (68 °F): 0.27 hPa · Density at 20 °C (68 °F): 1.05 g/cm³ (8.762 lbs/gal) · Bulk density at 20 °C (68 °F): 1.05 kg/m³ · Relative density Not determined. · Vapour density Not determined. · Evaporation rate Not determined. · Solubility in / Miscibility with Water: Not miscible or difficult to mix. · Partition coefficient (n-octanol/water): Not determined. · Viscosity: Dynamic: Not determined. Kinematic: Not determined. · Solvent content: Organic solvents: 0.0 % Solids content: 100.0 % · Other information No further relevant information available. (Contd. on page 5)Page 5/7 Safety Data Sheet acc. to OSHA HCS Printing date 06/04/2015 Reviewed on 06/04/2015 Trade name:H1 (Contd. of page 4) 40.1.310Stability and reactivity · Reactivity · Chemical stability · Thermal decomposition / conditions to be avoided: No decomposition if used according to specifications. · Possibility of hazardous reactions Reacts with alcohols, amines, aqueous acids and alkalis. Reacts with water and acids. · Conditions to avoid No further relevant information available. · Incompatible materials: No further relevant information available. · Hazardous decomposition products: No dangerous decomposition products known. 11Toxicological information · Information on toxicological effects · Acute toxicity: · Primary irritant effect: · on the","powder or water spray. If on skin: Wash with plenty of water. Take off contaminated clothing and wash it before reuse. Store locked up. Store in a well-ventilated place. Keep container tightly closed. Store in a well-ventilated place. Keep cool. Dispose of contents/container in accordance with local/regional/national/international regulations. · Other hazards · Results of PBT and vPvB assessment · PBT: Not applicable. · vPvB: Not applicable. * 3 Composition/information on ingredients · Chemical characterization: Mixtures · Description: Mixture of the substances listed below with nonhazardous additions. · Dangerous components: 7085-85-0 ethyl 2-cyanoacrylate 50-100% 142-16-5 Bis(2-ethylheyxl)maleate 0.1-<0.25% 123-31-9 1,4-dihydroxybenzene <0.1% * 4 First-aid measures · Description of first aid measures · After inhalation: Supply fresh air; consult doctor in case of complaints. · After skin contact: Immediately wash with water and soap and rinse thoroughly. · After eye contact: Rinse opened eye for several minutes under running water. Then consult a doctor. · After swallowing: Call a doctor immediately. · Information for doctor: · Most important symptoms and effects, both acute and delayed Breathing difficulty · Indication of any immediate medical attention and s pecial treatment needed No further relevant information available. 5 Fire-fighting measures · Extinguishing media · Suitable extinguishing agents: CO2, extinguishing powder or water spray. Fight larger fires with","· Reactivity · Chemical stability · Thermal decomposition / conditions to be avoided: No decomposition if used according to specifications. · Possibility of hazardous reactions Reacts with alcohols, amines, aqueous acids and alkalis. Reacts with water and acids. · Conditions to avoid No further relevant information available. · Incompatible materials: No further relevant information available. · Hazardous decomposition products: No dangerous decomposition products known. 11Toxicological information · Information on toxicological effects · Acute toxicity: · Primary irritant effect: · on the skin: Irritant to skin and mucous membranes. · on the eye: Irritating effect. · Sensitization: Sensitization possible through skin contact. · Additional toxicological information: The product shows the following dangers according to internally approved calculation methods for preparations: Irritant · Carcinogenic categories · IARC (International Agency for Research on Cancer) 123-31-9 1,4-dihydroxybenzene 3 · NTP (National Toxicology Program) None of the ingredients is listed. · OSHA-Ca (Occupational Safety & Health Administration) None of the ingredients is listed. 12Ecological information · Toxicity · Aquatic toxicity: No further relevant information available. · Persistence and degradability No further relevant information available. · Behavior in environmental systems: · Bioaccumulative potential No further relevant information available. · Mobility in soil No further relevant"
20,,,Is the product stable or reactive? Are there any hazardous reactions to be aware of?,"The product is stable if used according to specifications. It reacts with alcohols, amines, aqueous acids and alkalis, as well as water and acids, resulting in hazardous reactions.",40.1.3 · Reactivity · Chemical stability · Thermal decomposition / conditions to be avoided: No decomposition if used according to specifications. · Possibility of hazardous reactions,,"· Reactivity · Chemical stability · Thermal decomposition / conditions to be avoided: No decomposition if used according to specifications. · Possibility of hazardous reactions Reacts with alcohols, amines, aqueous acids and alkalis. Reacts with water and acids. · Conditions to avoid No further relevant information available. · Incompatible materials: No further relevant information available. · Hazardous decomposition products: No dangerous decomposition products known. 11Toxicological information · Information on toxicological effects · Acute toxicity: · Primary irritant effect: · on the skin: Irritant to skin and mucous membranes. · on the eye: Irritating effect. · Sensitization: Sensitization possible through skin contact. · Additional toxicological information: The product shows the following dangers according to internally approved calculation methods for preparations: Irritant · Carcinogenic categories · IARC (International Agency for Research on Cancer) 123-31-9 1,4-dihydroxybenzene 3 · NTP (National Toxicology Program) None of the ingredients is listed. · OSHA-Ca (Occupational Safety & Health Administration) None of the ingredients is listed. 12Ecological information · Toxicity · Aquatic toxicity: No further relevant information available. · Persistence and degradability No further relevant information available. · Behavior in environmental systems: · Bioaccumulative potential No further relevant information available. · Mobility in soil No further relevant","powder or water spray. If on skin: Wash with plenty of water. Take off contaminated clothing and wash it before reuse. Store locked up. Store in a well-ventilated place. Keep container tightly closed. Store in a well-ventilated place. Keep cool. Dispose of contents/container in accordance with local/regional/national/international regulations. · Other hazards · Results of PBT and vPvB assessment · PBT: Not applicable. · vPvB: Not applicable. * 3 Composition/information on ingredients · Chemical characterization: Mixtures · Description: Mixture of the substances listed below with nonhazardous additions. · Dangerous components: 7085-85-0 ethyl 2-cyanoacrylate 50-100% 142-16-5 Bis(2-ethylheyxl)maleate 0.1-<0.25% 123-31-9 1,4-dihydroxybenzene <0.1% * 4 First-aid measures · Description of first aid measures · After inhalation: Supply fresh air; consult doctor in case of complaints. · After skin contact: Immediately wash with water and soap and rinse thoroughly. · After eye contact: Rinse opened eye for several minutes under running water. Then consult a doctor. · After swallowing: Call a doctor immediately. · Information for doctor: · Most important symptoms and effects, both acute and delayed Breathing difficulty · Indication of any immediate medical attention and s pecial treatment needed No further relevant information available. 5 Fire-fighting measures · Extinguishing media · Suitable extinguishing agents: CO2, extinguishing powder or water spray. Fight larger fires with","system and skin. · Information concerning particular hazards for human and environment: The product has to be labeled due to the calculation procedure of international guidelines. · Classification system: The classification was made according to the latest editions of international substances lists, and expanded upon from company and literature data. · Label elements · GHS label elements The product is classified and labeled according to the Globally Harmonized System (GHS). · Hazard pictograms ~ GHS07 · Signal word Warning · Hazard-determining components of labeling: ethyl 2-cyanoacrylate · Hazard statements Combustible liquid. Causes skin irritation. Causes serious eye irritation. May cause respiratory irritation. (Contd. on page 2)Page 2/7 Safety Data Sheet acc. to OSHA HCS Printing date 06/04/2015 Reviewed on 06/04/2015 Trade name:H1 (Contd. of page 1) 40.1.3· Precautionary statements If medical advice is needed, have product container or label at hand. Keep out of reach of children. Read label before use. Keep away from flames and hot surfaces. – No smoking. Avoid breathing dust/fume/gas/mist/vapors/spray Wear protective gloves / eye protection / face protection. Wear protective gloves. Wear eye protection / face protection. Wash thoroughly after handling. Use only outdoors or in a well-ventilated area. If in eyes: Rinse cautiously with water for several minutes. Remove contact lenses, if present and easy to do. Continue rinsing. Specific treatment (see on this label).","· Auto igniting: Product is not selfigniting. · Danger of explosion: Not determined. · Explosion limits: Lower: Not determined. Upper: Not determined. · Vapor pressure at 20 °C (68 °F): 0.27 hPa · Density at 20 °C (68 °F): 1.05 g/cm³ (8.762 lbs/gal) · Bulk density at 20 °C (68 °F): 1.05 kg/m³ · Relative density Not determined. · Vapour density Not determined. · Evaporation rate Not determined. · Solubility in / Miscibility with Water: Not miscible or difficult to mix. · Partition coefficient (n-octanol/water): Not determined. · Viscosity: Dynamic: Not determined. Kinematic: Not determined. · Solvent content: Organic solvents: 0.0 % Solids content: 100.0 % · Other information No further relevant information available. (Contd. on page 5)Page 5/7 Safety Data Sheet acc. to OSHA HCS Printing date 06/04/2015 Reviewed on 06/04/2015 Trade name:H1 (Contd. of page 4) 40.1.310Stability and reactivity · Reactivity · Chemical stability · Thermal decomposition / conditions to be avoided: No decomposition if used according to specifications. · Possibility of hazardous reactions Reacts with alcohols, amines, aqueous acids and alkalis. Reacts with water and acids. · Conditions to avoid No further relevant information available. · Incompatible materials: No further relevant information available. · Hazardous decomposition products: No dangerous decomposition products known. 11Toxicological information · Information on toxicological effects · Acute toxicity: · Primary irritant effect: · on the"
21,,,What are the possible hazardous decomposition products of the product?,No dangerous decomposition products known.,Conditions to avoid,,"· Reactivity · Chemical stability · Thermal decomposition / conditions to be avoided: No decomposition if used according to specifications. · Possibility of hazardous reactions Reacts with alcohols, amines, aqueous acids and alkalis. Reacts with water and acids. · Conditions to avoid No further relevant information available. · Incompatible materials: No further relevant information available. · Hazardous decomposition products: No dangerous decomposition products known. 11Toxicological information · Information on toxicological effects · Acute toxicity: · Primary irritant effect: · on the skin: Irritant to skin and mucous membranes. · on the eye: Irritating effect. · Sensitization: Sensitization possible through skin contact. · Additional toxicological information: The product shows the following dangers according to internally approved calculation methods for preparations: Irritant · Carcinogenic categories · IARC (International Agency for Research on Cancer) 123-31-9 1,4-dihydroxybenzene 3 · NTP (National Toxicology Program) None of the ingredients is listed. · OSHA-Ca (Occupational Safety & Health Administration) None of the ingredients is listed. 12Ecological information · Toxicity · Aquatic toxicity: No further relevant information available. · Persistence and degradability No further relevant information available. · Behavior in environmental systems: · Bioaccumulative potential No further relevant information available. · Mobility in soil No further relevant","powder or water spray. If on skin: Wash with plenty of water. Take off contaminated clothing and wash it before reuse. Store locked up. Store in a well-ventilated place. Keep container tightly closed. Store in a well-ventilated place. Keep cool. Dispose of contents/container in accordance with local/regional/national/international regulations. · Other hazards · Results of PBT and vPvB assessment · PBT: Not applicable. · vPvB: Not applicable. * 3 Composition/information on ingredients · Chemical characterization: Mixtures · Description: Mixture of the substances listed below with nonhazardous additions. · Dangerous components: 7085-85-0 ethyl 2-cyanoacrylate 50-100% 142-16-5 Bis(2-ethylheyxl)maleate 0.1-<0.25% 123-31-9 1,4-dihydroxybenzene <0.1% * 4 First-aid measures · Description of first aid measures · After inhalation: Supply fresh air; consult doctor in case of complaints. · After skin contact: Immediately wash with water and soap and rinse thoroughly. · After eye contact: Rinse opened eye for several minutes under running water. Then consult a doctor. · After swallowing: Call a doctor immediately. · Information for doctor: · Most important symptoms and effects, both acute and delayed Breathing difficulty · Indication of any immediate medical attention and s pecial treatment needed No further relevant information available. 5 Fire-fighting measures · Extinguishing media · Suitable extinguishing agents: CO2, extinguishing powder or water spray. Fight larger fires with","or Spilled: Floors will becom e slippery. Avoid walking in product. K eep unessential personnel away. Mop up or otherwise absorb and hold disposal. Avoi d discharge to sewer or open waterways. Waste Disposal Method: Any method in accordance with local, state and federal laws. Best method is to recycle or reuse for intended purpose. Consult local authorities for disposal in public sewer. Do not dispose of into storm drain, stream, river or to ground. Rinse container thoroughly before discarding in trash. SECTION 10-REGULATORY INFORMATION SARA Title III - Section 311/312 -Hazard Categories: Shipping Information: HMIS Hazardous Materials No - Fire Hazard FOR CONTAINERS > Cleaning Compound Identification System No - Sudden Release of Pressure Hazard Health 2 No - Reactivity Hazard FOR 1 GALLON CONTAINERS: Cleaning Compound Flammability 0 Yes - Immediate (acute) Health Hazard Reactivity 0 No - Delayed (chronic) Health Hazard FOR CONTAINERS < 1 GALLON: Cleaning Compound Personal Protection D FOR EMERGENCY MEDICAL OR TRANSPORT INFORMATION: CHEM-TEL, Inc. @ 800-255-3924 ( 24 hours, 7 days per week) This product contains the following toxic chemical(s) subject to the r eporting requirements of section 313 of the Emergency Planning and Community Right-To-Know Act of 1986 and of 40 CFR 372. CAS# Chemical Name Percent by Weight 111-76-2 Glycol Ether 3% max. This product contains the following chemical(s) which have been established to be either a carcinogen or suspected carcinogen. CAS#","system and skin. · Information concerning particular hazards for human and environment: The product has to be labeled due to the calculation procedure of international guidelines. · Classification system: The classification was made according to the latest editions of international substances lists, and expanded upon from company and literature data. · Label elements · GHS label elements The product is classified and labeled according to the Globally Harmonized System (GHS). · Hazard pictograms ~ GHS07 · Signal word Warning · Hazard-determining components of labeling: ethyl 2-cyanoacrylate · Hazard statements Combustible liquid. Causes skin irritation. Causes serious eye irritation. May cause respiratory irritation. (Contd. on page 2)Page 2/7 Safety Data Sheet acc. to OSHA HCS Printing date 06/04/2015 Reviewed on 06/04/2015 Trade name:H1 (Contd. of page 1) 40.1.3· Precautionary statements If medical advice is needed, have product container or label at hand. Keep out of reach of children. Read label before use. Keep away from flames and hot surfaces. – No smoking. Avoid breathing dust/fume/gas/mist/vapors/spray Wear protective gloves / eye protection / face protection. Wear protective gloves. Wear eye protection / face protection. Wash thoroughly after handling. Use only outdoors or in a well-ventilated area. If in eyes: Rinse cautiously with water for several minutes. Remove contact lenses, if present and easy to do. Continue rinsing. Specific treatment (see on this label)."
22,,,What is the toxicological information available for the product?,Irritant to skin and mucous membranes. Irritating effect. Sensitization possible through skin contact.,11Toxicological information · Information on toxicological effects · Acute toxicity: · Primary irritant effect: · on the skin:,,"to cause developmental toxicity: None of the ingredients is listed. · Carcinogenic categories · EPA (Environmental Protection Agency) 109-63-7 diethyl ether--boron trifluoride I (oral) · TLV (Threshold Limit Value established by ACGIH) 123-31-9 1,4-dihydroxybenzene A3 · NIOSH-Ca (National Institute for Occupational Safety and Health) None of the ingredients is listed. (Contd. on page 7)Page 7/7 Safety Data Sheet acc. to OSHA HCS Printing date 06/04/2015 Reviewed on 06/04/2015 Trade name:H1 (Contd. of page 6) 40.1.3· GHS label elements The product is classified and labeled according to the Globally Harmonized System (GHS). · Hazard pictograms ~ GHS07 · Signal word Warning · Hazard-determining components of labeling: ethyl 2-cyanoacrylate · Hazard statements Combustible liquid. Causes skin irritation. Causes serious eye irritation. May cause respiratory irritation. · Precautionary statements If medical advice is needed, have product container or label at hand. Keep out of reach of children. Read label before use. Keep away from flames and hot surfaces. – No smoking. Avoid breathing dust/fume/gas/mist/vapors/spray Wear protective gloves / eye protection / face protection. Wear protective gloves. Wear eye protection / face protection. Wash thoroughly after handling. Use only outdoors or in a well-ventilated area. If in eyes: Rinse cautiously with water for several minutes. Remove contact lenses, if present and easy to do. Continue rinsing. Specific treatment (see on this","· Reactivity · Chemical stability · Thermal decomposition / conditions to be avoided: No decomposition if used according to specifications. · Possibility of hazardous reactions Reacts with alcohols, amines, aqueous acids and alkalis. Reacts with water and acids. · Conditions to avoid No further relevant information available. · Incompatible materials: No further relevant information available. · Hazardous decomposition products: No dangerous decomposition products known. 11Toxicological information · Information on toxicological effects · Acute toxicity: · Primary irritant effect: · on the skin: Irritant to skin and mucous membranes. · on the eye: Irritating effect. · Sensitization: Sensitization possible through skin contact. · Additional toxicological information: The product shows the following dangers according to internally approved calculation methods for preparations: Irritant · Carcinogenic categories · IARC (International Agency for Research on Cancer) 123-31-9 1,4-dihydroxybenzene 3 · NTP (National Toxicology Program) None of the ingredients is listed. · OSHA-Ca (Occupational Safety & Health Administration) None of the ingredients is listed. 12Ecological information · Toxicity · Aquatic toxicity: No further relevant information available. · Persistence and degradability No further relevant information available. · Behavior in environmental systems: · Bioaccumulative potential No further relevant information available. · Mobility in soil No further relevant","system and skin. · Information concerning particular hazards for human and environment: The product has to be labeled due to the calculation procedure of international guidelines. · Classification system: The classification was made according to the latest editions of international substances lists, and expanded upon from company and literature data. · Label elements · GHS label elements The product is classified and labeled according to the Globally Harmonized System (GHS). · Hazard pictograms ~ GHS07 · Signal word Warning · Hazard-determining components of labeling: ethyl 2-cyanoacrylate · Hazard statements Combustible liquid. Causes skin irritation. Causes serious eye irritation. May cause respiratory irritation. (Contd. on page 2)Page 2/7 Safety Data Sheet acc. to OSHA HCS Printing date 06/04/2015 Reviewed on 06/04/2015 Trade name:H1 (Contd. of page 1) 40.1.3· Precautionary statements If medical advice is needed, have product container or label at hand. Keep out of reach of children. Read label before use. Keep away from flames and hot surfaces. – No smoking. Avoid breathing dust/fume/gas/mist/vapors/spray Wear protective gloves / eye protection / face protection. Wear protective gloves. Wear eye protection / face protection. Wash thoroughly after handling. Use only outdoors or in a well-ventilated area. If in eyes: Rinse cautiously with water for several minutes. Remove contact lenses, if present and easy to do. Continue rinsing. Specific treatment (see on this label).","the International Carriage of Dangerous Goods by Road) DOT: US Department of Transportation ACGIH: American Conference of Governmental Industrial Hygienists EINECS: European Inventory of Existing Commercial Chemical Substances ELINCS: European List of Notified Chemical Substances CAS: Chemical Abstracts Service (division of the American Chemical Society) : Flammable liquids, Hazard Category 4 Skin Irrit. 2: Skin corrosion/irritation, Hazard Category 2 Eye Irrit. 2A: Serious eye damage/eye irritation, Hazard Category 2A STOT SE 3: Specific target organ toxicity - Single exposure, Hazard Category 3 · * Data compared to the previous version altered."
