,Source(T/F),Answer(T/F),Question,Answer,Source,Note,Context_1,Context_2,Context_3,Context_4
0,T,T,What is the product identifier?,Trade name:H1,Identification,,"system and skin. · Information concerning particular hazards for human and environment: The product has to be labeled due to the calculation procedure of international guidelines. · Classification system: The classification was made according to the latest editions of international substances lists, and expanded upon from company and literature data. · Label elements · GHS label elements The product is classified and labeled according to the Globally Harmonized System (GHS). · Hazard pictograms ~ GHS07 · Signal word Warning · Hazard-determining components of labeling: ethyl 2-cyanoacrylate · Hazard statements Combustible liquid. Causes skin irritation. Causes serious eye irritation. May cause respiratory irritation. (Contd. on page 2)Page 2/7 Safety Data Sheet acc. to OSHA HCS Printing date 06/04/2015 Reviewed on 06/04/2015 Trade name:H1 (Contd. of page 1) 40.1.3· Precautionary statements If medical advice is needed, have product container or label at hand. Keep out of reach of children. Read label before use. Keep away from flames and hot surfaces. – No smoking. Avoid breathing dust/fume/gas/mist/vapors/spray Wear protective gloves / eye protection / face protection. Wear protective gloves. Wear eye protection / face protection. Wash thoroughly after handling. Use only outdoors or in a well-ventilated area. If in eyes: Rinse cautiously with water for several minutes. Remove contact lenses, if present and easy to do. Continue rinsing. Specific treatment (see on this label).","Page 1/7 Safety Data Sheet acc. to OSHA HCS Printing date 06/04/2015 Reviewed on 06/04/2015 40.1.3* 1 Identification · Product identifier · Trade name:H1 · Application of the substance / the mixture Cyanoacrylate Adhesive · Details of the supplier of the safety data sheet · Manufacturer/Supplier: Cyberbond LLC 401 North Raddant Road Batavia, IL 60510 USA sales@cyberbond1.com 630-761-8900 · Information department: Product safety department · Emergency telephone number: International-1-(352)-323-3500 US & Canada-1-(800)-535-5053 2 Hazard(s) identification · Classification of the substance or mixture ~GHS07 Skin Irrit. 2 H315 Causes skin irritation. Eye Irrit. 2A H319 Causes serious eye irritation. STOT SE 3 H335 May cause respiratory irritation. H227 Combustible liquid. · Classification according to Directive 67/548/EEC or Directive 1999/45/EC ?@G?@GIrritant Irritating to eyes, respiratory system and skin. · Information concerning particular hazards for human and environment: The product has to be labeled due to the calculation procedure of international guidelines. · Classification system: The classification was made according to the latest editions of international substances lists, and expanded upon from company and literature data. · Label elements · GHS label elements The product is classified and labeled according to the Globally Harmonized System (GHS). · Hazard pictograms ~ GHS07 · Signal word Warning · Hazard-determining components of labeling: ethyl 2-cyanoacrylate","the International Carriage of Dangerous Goods by Road) DOT: US Department of Transportation ACGIH: American Conference of Governmental Industrial Hygienists EINECS: European Inventory of Existing Commercial Chemical Substances ELINCS: European List of Notified Chemical Substances CAS: Chemical Abstracts Service (division of the American Chemical Society) : Flammable liquids, Hazard Category 4 Skin Irrit. 2: Skin corrosion/irritation, Hazard Category 2 Eye Irrit. 2A: Serious eye damage/eye irritation, Hazard Category 2A STOT SE 3: Specific target organ toxicity - Single exposure, Hazard Category 3 · * Data compared to the previous version altered.","REG MATERIAL SAFETY DATA SHEET N/A=Not Applicable Prepared by: Regulatory Affairs Dept. (Prepared According to 29 CFR 1910.1200) Effective Date: 1/09 Revision: n/a SECTION 1-PRODUCT IDENTIFICAT ION AND SUPPLIER INFORMATION Manufacturer’s Name: Misco Products Corporation Manufacturer’s Address: 1048 Stinson Drive Reading, PA 19605 Manufacturer’s Phone #: ( 610) 926-4106 Product Name: Rev ite (Green) Generic Name: Heavy Duty Cleaner Degreaser Chemical Family: Alkaline Detergent Formula: Proprietary Supplier’s Name: Supplier’s Address: Supplier’s Phone #: SECTION 2-INGREDIENT INFORMATION CHEMICAL NAME CAS NO. WT. % PEL TWA-TLV STEL-TLV Water 7732-18-5 to 100 2-Butoxyethanol 111-76-2 0 to 5 25 ppm 25 ppm N/A Potassium Alkyl Aryl Sulfonate 27177-77-1 0 to 5 Potassium Tall Oil Soap 61790-44-1 0 to 5 Sodium Tripolyphosphate 7758-29-4 0 to 5 Dye N/A < 1 Fragrance N/A < 1 SECTION 3-PHYSICAL DATA SECTION 4-FIRE AND EXPLOSION HAZARD DATA Boiling Point ( °F): 212 F. Specific Gravity: 1.055 Vapor Pressure: 20mm Hg @ 68 F. Va por Density (Air=1): >1 % Volatile: 8 5+ pH: 12.0 – 13.0 Solubility in Water: Com plete Evaporation Rate (Water=1): <1 Physical Description: T hin green liquid with characteristic odor. VOC Content: 2.93% (wt/wt), 0.26 lbs/gal., 30.9 grams/liter Flash Point (Method Used): None ( waterbased) Upper Explosion Limit: N/A Lower Explosion Limit: N/A Extinguishing Media: N/A Special Firefighting Procedures: Non Flammable Unusual Fire and Explosion Hazards: N/A SECTION"
1,T,T,When was the Safety Data Sheet issued?,06/04/2015,Page 1/7 Safety Data Sheet acc. to OSHA HCS,,"on page 3)Page 3/7 Safety Data Sheet acc. to OSHA HCS Printing date 06/04/2015 Reviewed on 06/04/2015 Trade name:H1 (Contd. of page 2) 40.1.36 Accidental release measures · Personal precautions, protective equipment and emerg ency procedures Ensure adequate ventilation · Environmental precautions: Do not allow product to reach sewage system or any water course. · Methods and material for containment and cleaning u p: Allow to solidify. Pick up mechanically. Ensure adequate ventilation. Do not use cotton or natural fiber cloths for clean up · Reference to other sections See Section 7 for information on safe handling. See Section 8 for information on personal protection equipment. See Section 13 for disposal information. 7 Handling and storage · Handling: · Precautions for safe handling Store in cool, dry place in tightly closed receptacles. Keep away from heat and direct sunlight. Ensure good ventilation/exhaustion at the workplace. · Information about protection against explosions and fires: No special measures required. · Conditions for safe storage, including any incompat ibilities · Storage: · Requirements to be met by storerooms and receptacle s: Store in a cool location. Store only in the original receptacle. · Information about storage in one common storage fac ility: Store away from oxidizing agents. · Further information about storage conditions: Keep receptacle tightly sealed. · Specific end use(s) No further relevant information available. 8 Exposure","the International Carriage of Dangerous Goods by Road) DOT: US Department of Transportation ACGIH: American Conference of Governmental Industrial Hygienists EINECS: European Inventory of Existing Commercial Chemical Substances ELINCS: European List of Notified Chemical Substances CAS: Chemical Abstracts Service (division of the American Chemical Society) : Flammable liquids, Hazard Category 4 Skin Irrit. 2: Skin corrosion/irritation, Hazard Category 2 Eye Irrit. 2A: Serious eye damage/eye irritation, Hazard Category 2A STOT SE 3: Specific target organ toxicity - Single exposure, Hazard Category 3 · * Data compared to the previous version altered.","Page 1/7 Safety Data Sheet acc. to OSHA HCS Printing date 06/04/2015 Reviewed on 06/04/2015 40.1.3* 1 Identification · Product identifier · Trade name:H1 · Application of the substance / the mixture Cyanoacrylate Adhesive · Details of the supplier of the safety data sheet · Manufacturer/Supplier: Cyberbond LLC 401 North Raddant Road Batavia, IL 60510 USA sales@cyberbond1.com 630-761-8900 · Information department: Product safety department · Emergency telephone number: International-1-(352)-323-3500 US & Canada-1-(800)-535-5053 2 Hazard(s) identification · Classification of the substance or mixture ~GHS07 Skin Irrit. 2 H315 Causes skin irritation. Eye Irrit. 2A H319 Causes serious eye irritation. STOT SE 3 H335 May cause respiratory irritation. H227 Combustible liquid. · Classification according to Directive 67/548/EEC or Directive 1999/45/EC ?@G?@GIrritant Irritating to eyes, respiratory system and skin. · Information concerning particular hazards for human and environment: The product has to be labeled due to the calculation procedure of international guidelines. · Classification system: The classification was made according to the latest editions of international substances lists, and expanded upon from company and literature data. · Label elements · GHS label elements The product is classified and labeled according to the Globally Harmonized System (GHS). · Hazard pictograms ~ GHS07 · Signal word Warning · Hazard-determining components of labeling: ethyl 2-cyanoacrylate","system and skin. · Information concerning particular hazards for human and environment: The product has to be labeled due to the calculation procedure of international guidelines. · Classification system: The classification was made according to the latest editions of international substances lists, and expanded upon from company and literature data. · Label elements · GHS label elements The product is classified and labeled according to the Globally Harmonized System (GHS). · Hazard pictograms ~ GHS07 · Signal word Warning · Hazard-determining components of labeling: ethyl 2-cyanoacrylate · Hazard statements Combustible liquid. Causes skin irritation. Causes serious eye irritation. May cause respiratory irritation. (Contd. on page 2)Page 2/7 Safety Data Sheet acc. to OSHA HCS Printing date 06/04/2015 Reviewed on 06/04/2015 Trade name:H1 (Contd. of page 1) 40.1.3· Precautionary statements If medical advice is needed, have product container or label at hand. Keep out of reach of children. Read label before use. Keep away from flames and hot surfaces. – No smoking. Avoid breathing dust/fume/gas/mist/vapors/spray Wear protective gloves / eye protection / face protection. Wear protective gloves. Wear eye protection / face protection. Wash thoroughly after handling. Use only outdoors or in a well-ventilated area. If in eyes: Rinse cautiously with water for several minutes. Remove contact lenses, if present and easy to do. Continue rinsing. Specific treatment (see on this label)."
2,T,F,What is the product description?,A liquid cleaner degreaser.,"SECTION 1-PRODUCT IDENTIFICAT ION AND SUPPLIER INFORMATION, SECTION 3-PHYSICAL DATA",答案錯誤，應該為:Cyanoacrylate Adhesive,"system and skin. · Information concerning particular hazards for human and environment: The product has to be labeled due to the calculation procedure of international guidelines. · Classification system: The classification was made according to the latest editions of international substances lists, and expanded upon from company and literature data. · Label elements · GHS label elements The product is classified and labeled according to the Globally Harmonized System (GHS). · Hazard pictograms ~ GHS07 · Signal word Warning · Hazard-determining components of labeling: ethyl 2-cyanoacrylate · Hazard statements Combustible liquid. Causes skin irritation. Causes serious eye irritation. May cause respiratory irritation. (Contd. on page 2)Page 2/7 Safety Data Sheet acc. to OSHA HCS Printing date 06/04/2015 Reviewed on 06/04/2015 Trade name:H1 (Contd. of page 1) 40.1.3· Precautionary statements If medical advice is needed, have product container or label at hand. Keep out of reach of children. Read label before use. Keep away from flames and hot surfaces. – No smoking. Avoid breathing dust/fume/gas/mist/vapors/spray Wear protective gloves / eye protection / face protection. Wear protective gloves. Wear eye protection / face protection. Wash thoroughly after handling. Use only outdoors or in a well-ventilated area. If in eyes: Rinse cautiously with water for several minutes. Remove contact lenses, if present and easy to do. Continue rinsing. Specific treatment (see on this label).","the International Carriage of Dangerous Goods by Road) DOT: US Department of Transportation ACGIH: American Conference of Governmental Industrial Hygienists EINECS: European Inventory of Existing Commercial Chemical Substances ELINCS: European List of Notified Chemical Substances CAS: Chemical Abstracts Service (division of the American Chemical Society) : Flammable liquids, Hazard Category 4 Skin Irrit. 2: Skin corrosion/irritation, Hazard Category 2 Eye Irrit. 2A: Serious eye damage/eye irritation, Hazard Category 2A STOT SE 3: Specific target organ toxicity - Single exposure, Hazard Category 3 · * Data compared to the previous version altered.","and has to be observed. (Contd. on page 4)Page 4/7 Safety Data Sheet acc. to OSHA HCS Printing date 06/04/2015 Reviewed on 06/04/2015 Trade name:H1 (Contd. of page 3) 40.1.3· Not suitable are gloves made of the following materi als: Cotton or natural fibers PVC gloves · Eye protection: Safety glasses `RTightly sealed goggles · Body protection: Protective work clothing 9 Physical and chemical properties · Information on basic physical and chemical properti es · General Information · Appearance: Form: Liquid Color: According to product specification · Odor: Characteristic · Odour threshold: Not determined. · pH-value: Not determined. · Change in condition Melting point/Melting range: Undetermined. Boiling point/Boiling range: > 150 °C (> 302 °F) · Flash point: 87 °C (189 °F) · Flammability (solid, gaseous): Not applicable. · Ignition temperature: Decomposition temperature: Not determined. · Auto igniting: Product is not selfigniting. · Danger of explosion: Not determined. · Explosion limits: Lower: Not determined. Upper: Not determined. · Vapor pressure at 20 °C (68 °F): 0.27 hPa · Density at 20 °C (68 °F): 1.05 g/cm³ (8.762 lbs/gal) · Bulk density at 20 °C (68 °F): 1.05 kg/m³ · Relative density Not determined. · Vapour density Not determined. · Evaporation rate Not determined. · Solubility in / Miscibility with Water: Not miscible or difficult to mix. · Partition coefficient (n-octanol/water): Not determined. · Viscosity: Dynamic: Not determined. Kinematic: Not determined. ·","REG MATERIAL SAFETY DATA SHEET N/A=Not Applicable Prepared by: Regulatory Affairs Dept. (Prepared According to 29 CFR 1910.1200) Effective Date: 1/09 Revision: n/a SECTION 1-PRODUCT IDENTIFICAT ION AND SUPPLIER INFORMATION Manufacturer’s Name: Misco Products Corporation Manufacturer’s Address: 1048 Stinson Drive Reading, PA 19605 Manufacturer’s Phone #: ( 610) 926-4106 Product Name: Rev ite (Green) Generic Name: Heavy Duty Cleaner Degreaser Chemical Family: Alkaline Detergent Formula: Proprietary Supplier’s Name: Supplier’s Address: Supplier’s Phone #: SECTION 2-INGREDIENT INFORMATION CHEMICAL NAME CAS NO. WT. % PEL TWA-TLV STEL-TLV Water 7732-18-5 to 100 2-Butoxyethanol 111-76-2 0 to 5 25 ppm 25 ppm N/A Potassium Alkyl Aryl Sulfonate 27177-77-1 0 to 5 Potassium Tall Oil Soap 61790-44-1 0 to 5 Sodium Tripolyphosphate 7758-29-4 0 to 5 Dye N/A < 1 Fragrance N/A < 1 SECTION 3-PHYSICAL DATA SECTION 4-FIRE AND EXPLOSION HAZARD DATA Boiling Point ( °F): 212 F. Specific Gravity: 1.055 Vapor Pressure: 20mm Hg @ 68 F. Va por Density (Air=1): >1 % Volatile: 8 5+ pH: 12.0 – 13.0 Solubility in Water: Com plete Evaporation Rate (Water=1): <1 Physical Description: T hin green liquid with characteristic odor. VOC Content: 2.93% (wt/wt), 0.26 lbs/gal., 30.9 grams/liter Flash Point (Method Used): None ( waterbased) Upper Explosion Limit: N/A Lower Explosion Limit: N/A Extinguishing Media: N/A Special Firefighting Procedures: Non Flammable Unusual Fire and Explosion Hazards: N/A SECTION"
3,,,Who is the manufacturer of the product?,"Cyberbond LLC, Misco Products Corporation","40.1.3*, SECTION 1-PRODUCT IDENTIFICATION AND SUPPLIER INFORMATION",,"Page 1/7 Safety Data Sheet acc. to OSHA HCS Printing date 06/04/2015 Reviewed on 06/04/2015 40.1.3* 1 Identification · Product identifier · Trade name:H1 · Application of the substance / the mixture Cyanoacrylate Adhesive · Details of the supplier of the safety data sheet · Manufacturer/Supplier: Cyberbond LLC 401 North Raddant Road Batavia, IL 60510 USA sales@cyberbond1.com 630-761-8900 · Information department: Product safety department · Emergency telephone number: International-1-(352)-323-3500 US & Canada-1-(800)-535-5053 2 Hazard(s) identification · Classification of the substance or mixture ~GHS07 Skin Irrit. 2 H315 Causes skin irritation. Eye Irrit. 2A H319 Causes serious eye irritation. STOT SE 3 H335 May cause respiratory irritation. H227 Combustible liquid. · Classification according to Directive 67/548/EEC or Directive 1999/45/EC ?@G?@GIrritant Irritating to eyes, respiratory system and skin. · Information concerning particular hazards for human and environment: The product has to be labeled due to the calculation procedure of international guidelines. · Classification system: The classification was made according to the latest editions of international substances lists, and expanded upon from company and literature data. · Label elements · GHS label elements The product is classified and labeled according to the Globally Harmonized System (GHS). · Hazard pictograms ~ GHS07 · Signal word Warning · Hazard-determining components of labeling: ethyl 2-cyanoacrylate","system and skin. · Information concerning particular hazards for human and environment: The product has to be labeled due to the calculation procedure of international guidelines. · Classification system: The classification was made according to the latest editions of international substances lists, and expanded upon from company and literature data. · Label elements · GHS label elements The product is classified and labeled according to the Globally Harmonized System (GHS). · Hazard pictograms ~ GHS07 · Signal word Warning · Hazard-determining components of labeling: ethyl 2-cyanoacrylate · Hazard statements Combustible liquid. Causes skin irritation. Causes serious eye irritation. May cause respiratory irritation. (Contd. on page 2)Page 2/7 Safety Data Sheet acc. to OSHA HCS Printing date 06/04/2015 Reviewed on 06/04/2015 Trade name:H1 (Contd. of page 1) 40.1.3· Precautionary statements If medical advice is needed, have product container or label at hand. Keep out of reach of children. Read label before use. Keep away from flames and hot surfaces. – No smoking. Avoid breathing dust/fume/gas/mist/vapors/spray Wear protective gloves / eye protection / face protection. Wear protective gloves. Wear eye protection / face protection. Wash thoroughly after handling. Use only outdoors or in a well-ventilated area. If in eyes: Rinse cautiously with water for several minutes. Remove contact lenses, if present and easy to do. Continue rinsing. Specific treatment (see on this label).","REG MATERIAL SAFETY DATA SHEET N/A=Not Applicable Prepared by: Regulatory Affairs Dept. (Prepared According to 29 CFR 1910.1200) Effective Date: 1/09 Revision: n/a SECTION 1-PRODUCT IDENTIFICAT ION AND SUPPLIER INFORMATION Manufacturer’s Name: Misco Products Corporation Manufacturer’s Address: 1048 Stinson Drive Reading, PA 19605 Manufacturer’s Phone #: ( 610) 926-4106 Product Name: Rev ite (Green) Generic Name: Heavy Duty Cleaner Degreaser Chemical Family: Alkaline Detergent Formula: Proprietary Supplier’s Name: Supplier’s Address: Supplier’s Phone #: SECTION 2-INGREDIENT INFORMATION CHEMICAL NAME CAS NO. WT. % PEL TWA-TLV STEL-TLV Water 7732-18-5 to 100 2-Butoxyethanol 111-76-2 0 to 5 25 ppm 25 ppm N/A Potassium Alkyl Aryl Sulfonate 27177-77-1 0 to 5 Potassium Tall Oil Soap 61790-44-1 0 to 5 Sodium Tripolyphosphate 7758-29-4 0 to 5 Dye N/A < 1 Fragrance N/A < 1 SECTION 3-PHYSICAL DATA SECTION 4-FIRE AND EXPLOSION HAZARD DATA Boiling Point ( °F): 212 F. Specific Gravity: 1.055 Vapor Pressure: 20mm Hg @ 68 F. Va por Density (Air=1): >1 % Volatile: 8 5+ pH: 12.0 – 13.0 Solubility in Water: Com plete Evaporation Rate (Water=1): <1 Physical Description: T hin green liquid with characteristic odor. VOC Content: 2.93% (wt/wt), 0.26 lbs/gal., 30.9 grams/liter Flash Point (Method Used): None ( waterbased) Upper Explosion Limit: N/A Lower Explosion Limit: N/A Extinguishing Media: N/A Special Firefighting Procedures: Non Flammable Unusual Fire and Explosion Hazards: N/A SECTION","and has to be observed. (Contd. on page 4)Page 4/7 Safety Data Sheet acc. to OSHA HCS Printing date 06/04/2015 Reviewed on 06/04/2015 Trade name:H1 (Contd. of page 3) 40.1.3· Not suitable are gloves made of the following materi als: Cotton or natural fibers PVC gloves · Eye protection: Safety glasses `RTightly sealed goggles · Body protection: Protective work clothing 9 Physical and chemical properties · Information on basic physical and chemical properti es · General Information · Appearance: Form: Liquid Color: According to product specification · Odor: Characteristic · Odour threshold: Not determined. · pH-value: Not determined. · Change in condition Melting point/Melting range: Undetermined. Boiling point/Boiling range: > 150 °C (> 302 °F) · Flash point: 87 °C (189 °F) · Flammability (solid, gaseous): Not applicable. · Ignition temperature: Decomposition temperature: Not determined. · Auto igniting: Product is not selfigniting. · Danger of explosion: Not determined. · Explosion limits: Lower: Not determined. Upper: Not determined. · Vapor pressure at 20 °C (68 °F): 0.27 hPa · Density at 20 °C (68 °F): 1.05 g/cm³ (8.762 lbs/gal) · Bulk density at 20 °C (68 °F): 1.05 kg/m³ · Relative density Not determined. · Vapour density Not determined. · Evaporation rate Not determined. · Solubility in / Miscibility with Water: Not miscible or difficult to mix. · Partition coefficient (n-octanol/water): Not determined. · Viscosity: Dynamic: Not determined. Kinematic: Not determined. ·"
