,Source(T/F),Answer(T/F),Question,Answer,Source,Note,Context_1,Context_2,Context_3,Context_4
31,,,Are there any specific storage requirements or conditions for safely storing the product?,Store in a cool location. Store only in the original receptacle. Keep receptacle tightly sealed. Store away from oxidizing agents.,"7 Handling and storage, 7 Handling and storage, 9 Physical and chemical properties, 1 Information on basic physical and chemical data",,"Ensure good ventilation/exhaustion at the workplace. · Information about protection against explosions and fires: No special measures required. · Conditions for safe storage, including any incompat ibilities · Storage: · Requirements to be met by storerooms and receptacle s: Store in a cool location. Store only in the original receptacle. · Information about storage in one common storage fac ility: Store away from oxidizing agents. · Further information about storage conditions: Keep receptacle tightly sealed. · Specific end use(s) No further relevant information available. 8 Exposure controls/personal protection · Additional information about design of technical sy stems: No further data; see item 7. · Control parameters · Components with limit values that require monitoring at the workplace: 7085-85-0 ethyl 2-cyanoacrylate TLV Long-term value: 1 mg/m³, 0.2 ppm · Additional information: The lists that were valid during the creation were used as basis. · Exposure controls · Personal protective equipment: · General protective and hygienic measures: The usual precautionary measures for handling chemicals should be followed. Keep away from foodstuffs, beverages and feed. Immediately remove all soiled and contaminated clothing. Avoid contact with the eyes and skin. · Breathing equipment: Not necessary if room is well-ventilated. · Protection of hands: `SProtective gloves Impervious gloves The glove material has to be impermeable and resistant to the product/ the substance/ the","on page 3)Page 3/7 Safety Data Sheet acc. to OSHA HCS Printing date 06/04/2015 Reviewed on 06/04/2015 Trade name:H1 (Contd. of page 2) 40.1.36 Accidental release measures · Personal precautions, protective equipment and emerg ency procedures Ensure adequate ventilation · Environmental precautions: Do not allow product to reach sewage system or any water course. · Methods and material for containment and cleaning u p: Allow to solidify. Pick up mechanically. Ensure adequate ventilation. Do not use cotton or natural fiber cloths for clean up · Reference to other sections See Section 7 for information on safe handling. See Section 8 for information on personal protection equipment. See Section 13 for disposal information. 7 Handling and storage · Handling: · Precautions for safe handling Store in cool, dry place in tightly closed receptacles. Keep away from heat and direct sunlight. Ensure good ventilation/exhaustion at the workplace. · Information about protection against explosions and fires: No special measures required. · Conditions for safe storage, including any incompat ibilities · Storage: · Requirements to be met by storerooms and receptacle s: Store in a cool location. Store only in the original receptacle. · Information about storage in one common storage fac ility: Store away from oxidizing agents. · Further information about storage conditions: Keep receptacle tightly sealed. · Specific end use(s) No further relevant information available. 8 Exposure","If medical advice is needed, have product container or label at hand. Keep out of reach of children. Read label before use. Keep away from flames and hot surfaces. – No smoking. Avoid breathing dust/fume/gas/mist/vapors/spray Wear protective gloves / eye protection / face protection. Wear protective gloves. Wear eye protection / face protection. Wash thoroughly after handling. Use only outdoors or in a well-ventilated area. If in eyes: Rinse cautiously with water for several minutes. Remove contact lenses, if present and easy to do. Continue rinsing. Specific treatment (see on this label). IF INHALED: Remove victim to fresh air and keep at rest in a position comfortable for breathing. Call a poison center/doctor if you feel unwell. If skin irritation occurs: Get medical advice/attention. If eye irritation persists: Get medical advice/attention. In case of fire: Use for extinction: CO2, powder or water spray. If on skin: Wash with plenty of water. Take off contaminated clothing and wash it before reuse. Store locked up. Store in a well-ventilated place. Keep container tightly closed. Store in a well-ventilated place. Keep cool. Dispose of contents/container in accordance with local/regional/national/international regulations. · Other hazards · Results of PBT and vPvB assessment · PBT: Not applicable. · vPvB: Not applicable. * 3 Composition/information on ingredients · Chemical characterization: Mixtures · Description: Mixture of the substances listed below with nonhazardous","statements If medical advice is needed, have product container or label at hand. Keep out of reach of children. Read label before use. Keep away from flames and hot surfaces. – No smoking. Avoid breathing dust/fume/gas/mist/vapors/spray Wear protective gloves / eye protection / face protection. Wear protective gloves. Wear eye protection / face protection. Wash thoroughly after handling. Use only outdoors or in a well-ventilated area. If in eyes: Rinse cautiously with water for several minutes. Remove contact lenses, if present and easy to do. Continue rinsing. Specific treatment (see on this label). IF INHALED: Remove victim to fresh air and keep at rest in a position comfortable for breathing. Call a poison center/doctor if you feel unwell. If skin irritation occurs: Get medical advice/attention. If eye irritation persists: Get medical advice/attention. In case of fire: Use for extinction: CO2, powder or water spray. If on skin: Wash with plenty of water. Take off contaminated clothing and wash it before reuse. Store locked up. Store in a well-ventilated place. Keep container tightly closed. Store in a well-ventilated place. Keep cool. Dispose of contents/container in accordance with local/regional/national/international regulations. · Chemical safety assessment: A Chemical Safety Assessment has not been carried out. * 16Other information This information is based on our present knowledge. However, this shall not constitute a guarantee for any specific product features and"
32,,,What is the shelf life of the product?,Store in a cool location.,"Conditions for safe storage, including any incompatibilities",,"Ensure good ventilation/exhaustion at the workplace. · Information about protection against explosions and fires: No special measures required. · Conditions for safe storage, including any incompat ibilities · Storage: · Requirements to be met by storerooms and receptacle s: Store in a cool location. Store only in the original receptacle. · Information about storage in one common storage fac ility: Store away from oxidizing agents. · Further information about storage conditions: Keep receptacle tightly sealed. · Specific end use(s) No further relevant information available. 8 Exposure controls/personal protection · Additional information about design of technical sy stems: No further data; see item 7. · Control parameters · Components with limit values that require monitoring at the workplace: 7085-85-0 ethyl 2-cyanoacrylate TLV Long-term value: 1 mg/m³, 0.2 ppm · Additional information: The lists that were valid during the creation were used as basis. · Exposure controls · Personal protective equipment: · General protective and hygienic measures: The usual precautionary measures for handling chemicals should be followed. Keep away from foodstuffs, beverages and feed. Immediately remove all soiled and contaminated clothing. Avoid contact with the eyes and skin. · Breathing equipment: Not necessary if room is well-ventilated. · Protection of hands: `SProtective gloves Impervious gloves The glove material has to be impermeable and resistant to the product/ the substance/ the","system and skin. · Information concerning particular hazards for human and environment: The product has to be labeled due to the calculation procedure of international guidelines. · Classification system: The classification was made according to the latest editions of international substances lists, and expanded upon from company and literature data. · Label elements · GHS label elements The product is classified and labeled according to the Globally Harmonized System (GHS). · Hazard pictograms ~ GHS07 · Signal word Warning · Hazard-determining components of labeling: ethyl 2-cyanoacrylate · Hazard statements Combustible liquid. Causes skin irritation. Causes serious eye irritation. May cause respiratory irritation. (Contd. on page 2)Page 2/7 Safety Data Sheet acc. to OSHA HCS Printing date 06/04/2015 Reviewed on 06/04/2015 Trade name:H1 (Contd. of page 1) 40.1.3· Precautionary statements If medical advice is needed, have product container or label at hand. Keep out of reach of children. Read label before use. Keep away from flames and hot surfaces. – No smoking. Avoid breathing dust/fume/gas/mist/vapors/spray Wear protective gloves / eye protection / face protection. Wear protective gloves. Wear eye protection / face protection. Wash thoroughly after handling. Use only outdoors or in a well-ventilated area. If in eyes: Rinse cautiously with water for several minutes. Remove contact lenses, if present and easy to do. Continue rinsing. Specific treatment (see on this label).","CO2, powder or water spray. If on skin: Wash with plenty of water. Take off contaminated clothing and wash it before reuse. Store locked up. Store in a well-ventilated place. Keep container tightly closed. Store in a well-ventilated place. Keep cool. Dispose of contents/container in accordance with local/regional/national/international regulations. · Chemical safety assessment: A Chemical Safety Assessment has not been carried out. * 16Other information This information is based on our present knowledge. However, this shall not constitute a guarantee for any specific product features and shall not establish a legally valid contractual relationship. · Department issuing SDS: Product Safety Department · Date of preparation / last revision 06/04/2015 / 1 · Abbreviations and acronyms: ADR: Accord européen sur le transport des marchandises dangereuses par Route (European Agreement concerning the International Carriage of Dangerous Goods by Road) DOT: US Department of Transportation ACGIH: American Conference of Governmental Industrial Hygienists EINECS: European Inventory of Existing Commercial Chemical Substances ELINCS: European List of Notified Chemical Substances CAS: Chemical Abstracts Service (division of the American Chemical Society) : Flammable liquids, Hazard Category 4 Skin Irrit. 2: Skin corrosion/irritation, Hazard Category 2 Eye Irrit. 2A: Serious eye damage/eye irritation, Hazard Category 2A STOT SE 3: Specific target organ toxicity - Single exposure, Hazard","powder or water spray. If on skin: Wash with plenty of water. Take off contaminated clothing and wash it before reuse. Store locked up. Store in a well-ventilated place. Keep container tightly closed. Store in a well-ventilated place. Keep cool. Dispose of contents/container in accordance with local/regional/national/international regulations. · Other hazards · Results of PBT and vPvB assessment · PBT: Not applicable. · vPvB: Not applicable. * 3 Composition/information on ingredients · Chemical characterization: Mixtures · Description: Mixture of the substances listed below with nonhazardous additions. · Dangerous components: 7085-85-0 ethyl 2-cyanoacrylate 50-100% 142-16-5 Bis(2-ethylheyxl)maleate 0.1-<0.25% 123-31-9 1,4-dihydroxybenzene <0.1% * 4 First-aid measures · Description of first aid measures · After inhalation: Supply fresh air; consult doctor in case of complaints. · After skin contact: Immediately wash with water and soap and rinse thoroughly. · After eye contact: Rinse opened eye for several minutes under running water. Then consult a doctor. · After swallowing: Call a doctor immediately. · Information for doctor: · Most important symptoms and effects, both acute and delayed Breathing difficulty · Indication of any immediate medical attention and s pecial treatment needed No further relevant information available. 5 Fire-fighting measures · Extinguishing media · Suitable extinguishing agents: CO2, extinguishing powder or water spray. Fight larger fires with"
33,,,What are the composition and ingredients of the product?,"Mixture of ethyl 2-cyanoacrylate, Bis(2-ethylhexyl)maleate, and 1,4-dihydroxybenzene with nonhazardous additions.",3 Composition/information on ingredients,,"powder or water spray. If on skin: Wash with plenty of water. Take off contaminated clothing and wash it before reuse. Store locked up. Store in a well-ventilated place. Keep container tightly closed. Store in a well-ventilated place. Keep cool. Dispose of contents/container in accordance with local/regional/national/international regulations. · Other hazards · Results of PBT and vPvB assessment · PBT: Not applicable. · vPvB: Not applicable. * 3 Composition/information on ingredients · Chemical characterization: Mixtures · Description: Mixture of the substances listed below with nonhazardous additions. · Dangerous components: 7085-85-0 ethyl 2-cyanoacrylate 50-100% 142-16-5 Bis(2-ethylheyxl)maleate 0.1-<0.25% 123-31-9 1,4-dihydroxybenzene <0.1% * 4 First-aid measures · Description of first aid measures · After inhalation: Supply fresh air; consult doctor in case of complaints. · After skin contact: Immediately wash with water and soap and rinse thoroughly. · After eye contact: Rinse opened eye for several minutes under running water. Then consult a doctor. · After swallowing: Call a doctor immediately. · Information for doctor: · Most important symptoms and effects, both acute and delayed Breathing difficulty · Indication of any immediate medical attention and s pecial treatment needed No further relevant information available. 5 Fire-fighting measures · Extinguishing media · Suitable extinguishing agents: CO2, extinguishing powder or water spray. Fight larger fires with","to cause developmental toxicity: None of the ingredients is listed. · Carcinogenic categories · EPA (Environmental Protection Agency) 109-63-7 diethyl ether--boron trifluoride I (oral) · TLV (Threshold Limit Value established by ACGIH) 123-31-9 1,4-dihydroxybenzene A3 · NIOSH-Ca (National Institute for Occupational Safety and Health) None of the ingredients is listed. (Contd. on page 7)Page 7/7 Safety Data Sheet acc. to OSHA HCS Printing date 06/04/2015 Reviewed on 06/04/2015 Trade name:H1 (Contd. of page 6) 40.1.3· GHS label elements The product is classified and labeled according to the Globally Harmonized System (GHS). · Hazard pictograms ~ GHS07 · Signal word Warning · Hazard-determining components of labeling: ethyl 2-cyanoacrylate · Hazard statements Combustible liquid. Causes skin irritation. Causes serious eye irritation. May cause respiratory irritation. · Precautionary statements If medical advice is needed, have product container or label at hand. Keep out of reach of children. Read label before use. Keep away from flames and hot surfaces. – No smoking. Avoid breathing dust/fume/gas/mist/vapors/spray Wear protective gloves / eye protection / face protection. Wear protective gloves. Wear eye protection / face protection. Wash thoroughly after handling. Use only outdoors or in a well-ventilated area. If in eyes: Rinse cautiously with water for several minutes. Remove contact lenses, if present and easy to do. Continue rinsing. Specific treatment (see on this","· Reactivity · Chemical stability · Thermal decomposition / conditions to be avoided: No decomposition if used according to specifications. · Possibility of hazardous reactions Reacts with alcohols, amines, aqueous acids and alkalis. Reacts with water and acids. · Conditions to avoid No further relevant information available. · Incompatible materials: No further relevant information available. · Hazardous decomposition products: No dangerous decomposition products known. 11Toxicological information · Information on toxicological effects · Acute toxicity: · Primary irritant effect: · on the skin: Irritant to skin and mucous membranes. · on the eye: Irritating effect. · Sensitization: Sensitization possible through skin contact. · Additional toxicological information: The product shows the following dangers according to internally approved calculation methods for preparations: Irritant · Carcinogenic categories · IARC (International Agency for Research on Cancer) 123-31-9 1,4-dihydroxybenzene 3 · NTP (National Toxicology Program) None of the ingredients is listed. · OSHA-Ca (Occupational Safety & Health Administration) None of the ingredients is listed. 12Ecological information · Toxicity · Aquatic toxicity: No further relevant information available. · Persistence and degradability No further relevant information available. · Behavior in environmental systems: · Bioaccumulative potential No further relevant information available. · Mobility in soil No further relevant","system and skin. · Information concerning particular hazards for human and environment: The product has to be labeled due to the calculation procedure of international guidelines. · Classification system: The classification was made according to the latest editions of international substances lists, and expanded upon from company and literature data. · Label elements · GHS label elements The product is classified and labeled according to the Globally Harmonized System (GHS). · Hazard pictograms ~ GHS07 · Signal word Warning · Hazard-determining components of labeling: ethyl 2-cyanoacrylate · Hazard statements Combustible liquid. Causes skin irritation. Causes serious eye irritation. May cause respiratory irritation. (Contd. on page 2)Page 2/7 Safety Data Sheet acc. to OSHA HCS Printing date 06/04/2015 Reviewed on 06/04/2015 Trade name:H1 (Contd. of page 1) 40.1.3· Precautionary statements If medical advice is needed, have product container or label at hand. Keep out of reach of children. Read label before use. Keep away from flames and hot surfaces. – No smoking. Avoid breathing dust/fume/gas/mist/vapors/spray Wear protective gloves / eye protection / face protection. Wear protective gloves. Wear eye protection / face protection. Wash thoroughly after handling. Use only outdoors or in a well-ventilated area. If in eyes: Rinse cautiously with water for several minutes. Remove contact lenses, if present and easy to do. Continue rinsing. Specific treatment (see on this label)."
34,,,Are there any known hazardous reactions or incompatibilities with other substances or materials?,"Reacts with alcohols, amines, aqueous acids and alkalis. Reacts with water and acids.",REACTIVITY DATA,,"· Reactivity · Chemical stability · Thermal decomposition / conditions to be avoided: No decomposition if used according to specifications. · Possibility of hazardous reactions Reacts with alcohols, amines, aqueous acids and alkalis. Reacts with water and acids. · Conditions to avoid No further relevant information available. · Incompatible materials: No further relevant information available. · Hazardous decomposition products: No dangerous decomposition products known. 11Toxicological information · Information on toxicological effects · Acute toxicity: · Primary irritant effect: · on the skin: Irritant to skin and mucous membranes. · on the eye: Irritating effect. · Sensitization: Sensitization possible through skin contact. · Additional toxicological information: The product shows the following dangers according to internally approved calculation methods for preparations: Irritant · Carcinogenic categories · IARC (International Agency for Research on Cancer) 123-31-9 1,4-dihydroxybenzene 3 · NTP (National Toxicology Program) None of the ingredients is listed. · OSHA-Ca (Occupational Safety & Health Administration) None of the ingredients is listed. 12Ecological information · Toxicity · Aquatic toxicity: No further relevant information available. · Persistence and degradability No further relevant information available. · Behavior in environmental systems: · Bioaccumulative potential No further relevant information available. · Mobility in soil No further relevant","powder or water spray. If on skin: Wash with plenty of water. Take off contaminated clothing and wash it before reuse. Store locked up. Store in a well-ventilated place. Keep container tightly closed. Store in a well-ventilated place. Keep cool. Dispose of contents/container in accordance with local/regional/national/international regulations. · Other hazards · Results of PBT and vPvB assessment · PBT: Not applicable. · vPvB: Not applicable. * 3 Composition/information on ingredients · Chemical characterization: Mixtures · Description: Mixture of the substances listed below with nonhazardous additions. · Dangerous components: 7085-85-0 ethyl 2-cyanoacrylate 50-100% 142-16-5 Bis(2-ethylheyxl)maleate 0.1-<0.25% 123-31-9 1,4-dihydroxybenzene <0.1% * 4 First-aid measures · Description of first aid measures · After inhalation: Supply fresh air; consult doctor in case of complaints. · After skin contact: Immediately wash with water and soap and rinse thoroughly. · After eye contact: Rinse opened eye for several minutes under running water. Then consult a doctor. · After swallowing: Call a doctor immediately. · Information for doctor: · Most important symptoms and effects, both acute and delayed Breathing difficulty · Indication of any immediate medical attention and s pecial treatment needed No further relevant information available. 5 Fire-fighting measures · Extinguishing media · Suitable extinguishing agents: CO2, extinguishing powder or water spray. Fight larger fires with","DATA SECTION 4-FIRE AND EXPLOSION HAZARD DATA Boiling Point ( °F): 212 F. Specific Gravity: 1.055 Vapor Pressure: 20mm Hg @ 68 F. Va por Density (Air=1): >1 % Volatile: 8 5+ pH: 12.0 – 13.0 Solubility in Water: Com plete Evaporation Rate (Water=1): <1 Physical Description: T hin green liquid with characteristic odor. VOC Content: 2.93% (wt/wt), 0.26 lbs/gal., 30.9 grams/liter Flash Point (Method Used): None ( waterbased) Upper Explosion Limit: N/A Lower Explosion Limit: N/A Extinguishing Media: N/A Special Firefighting Procedures: Non Flammable Unusual Fire and Explosion Hazards: N/A SECTION 5-REACTIVITY DATA Stability: Stable Hazardous Polymerization: None Hazards Decomposition Products: Alkaline vapors in a fire. Incompatibility (Materials to Avoid): Str ong acids. SECTION 6-STORAGE AND HANDLING INFORMATION WARNING: Eye Irritant. May cause skin irritation with prolong or repeated contact. Avoid contact with eyes, skin and clothing. Wear rubber gloves, chemical splash goggles and protective outerwear wh en handling. Avoid breathing of vapors or mists. Use in well- ventilated area. Keep out of r each of children. For use by trained personnel only. Keep container closed during stor age. For institutional and industrial use only. SECTION 7-HEALTH HAZARDS AND FIRST AID SECTION 8-SPECIAL PROTECTION INFORMATION Effects of Overexposure: Skin: M oderate skin irritant. Prolonged or repeated contact may cause redness, dermatitis . Eyes: Ey e irritant. Liquid and mists will cause","· Auto igniting: Product is not selfigniting. · Danger of explosion: Not determined. · Explosion limits: Lower: Not determined. Upper: Not determined. · Vapor pressure at 20 °C (68 °F): 0.27 hPa · Density at 20 °C (68 °F): 1.05 g/cm³ (8.762 lbs/gal) · Bulk density at 20 °C (68 °F): 1.05 kg/m³ · Relative density Not determined. · Vapour density Not determined. · Evaporation rate Not determined. · Solubility in / Miscibility with Water: Not miscible or difficult to mix. · Partition coefficient (n-octanol/water): Not determined. · Viscosity: Dynamic: Not determined. Kinematic: Not determined. · Solvent content: Organic solvents: 0.0 % Solids content: 100.0 % · Other information No further relevant information available. (Contd. on page 5)Page 5/7 Safety Data Sheet acc. to OSHA HCS Printing date 06/04/2015 Reviewed on 06/04/2015 Trade name:H1 (Contd. of page 4) 40.1.310Stability and reactivity · Reactivity · Chemical stability · Thermal decomposition / conditions to be avoided: No decomposition if used according to specifications. · Possibility of hazardous reactions Reacts with alcohols, amines, aqueous acids and alkalis. Reacts with water and acids. · Conditions to avoid No further relevant information available. · Incompatible materials: No further relevant information available. · Hazardous decomposition products: No dangerous decomposition products known. 11Toxicological information · Information on toxicological effects · Acute toxicity: · Primary irritant effect: · on the"
