,Question,Answer,Source,Context_1,Context_2,Context_3,Context_4
0,"[""What is the purpose of the 'Motor Protection Function' in Yaskawa V1000?""]",['I dont know'],['N/A'],"['Yaskawa or your Yaskawa agent concerning applications with a larger inertia moment. • Holding Brake: When using a holding brake in Open Loop Vector Control for PM motors, release the brake prior to starting the motor. Failure to set the proper timing can result in speed loss. Not for use with conveyor, transport, or hoist type applications. • Restarting a Coasting Motor: To restart a coasting motor rotating at over 200 Hz while in the V/f control mode, use the Short Circuit Braking function to first bring the motor to a stop. Short Circuit Braking requires a special braking resistor. Contact Yaskawa or your Yaskawa agent for details. Speed Search can be used to restart a coasting motor rotating slower than 200 Hz. If the motor cable is relatively long, however, the motor should instead be stopped using Short Circuit Braking, which forces the motor to stop by creating a short-circuit in the motor windings. nApplications with Specialized Motors Multi-Pole Motor Because the rated current will differ from a standard motor, be sure to check the maximum current when selecting a drive. Always stop the motor before switching between the number of motor poles. If a regen overvoltage (oV) fault occurs or if overcurrent protection (oC) is triggered, the motor will coast to stop. Submersible Motor Because motor rated current is greater than a standard motor, select the drive capacity accordingly. Be sure to use a large enough gauge motor cable to avoid decreasing the maximum torque']","['of over 440 V or particularly long wiring distances. Contact Yaskawa or your Yaskawa agent for consultation.i.3 Application Precautions 20 YASKAWA ELECTRIC SIEP C710606 18F YASKAWA AC Drive – V1000 Technical ManualHigh Speed Operation Problems may occur with the motor bearings and dynamic balance of the machine when operating a motor beyond its rated speed. Contact the motor or machine manufacturer. Torque Characteristics Torque characteristics differ compared to operating the motor directly from line power. The user should have a full understanding of the load torque characteristics for the application. Vibration and Shock The drive settings allow the user to choose between high carrier PWM control and low carrier PWM. Selecting high carrier PWM can help reduce motor oscillation. Take particular caution when using a variable speed drive for an application that is conventionally run from line power at a constant speed. If mechanical resonance occurs, install shock-absorbing rubber around the base of the motor and enable the Jump frequency selection parameter to prevent continuous operation in the resonant frequency range. Audible Noise Noise created during run varies by the carrier frequency setting. When using a high carrier frequency, audible noise from the motor is comparable to the motor noise generated when running from line power. Operating above the rated r/min, however, can create unpleasant motor noise. nUsing a Synchronous Motor • Synchronous motors cannot be']","['proper direction. • The motor should accelerate and decelerate smoothly. nOperating the Motor under Loaded Conditions Test run the application similarly to the no-load test procedure when connecting the machinery to the motor. • Check monitor parameter U1-03 to ensure there is no overcurrent. • If the application permits running the load in the reverse direction, try changing motor direction and the frequency reference while watching for abnormal motor oscillation or vibration. • Correct any problems that occurs with hunting, oscillation, or other control-related issues.4.9 Test Run with Load Connected YASKAWA ELECTRIC SIEP C710606 18F YASKAWA AC Drive – V1000 Technical Manual 1094Start-Up Programming & Operation4.10 Verifying Parameter Settings and Backing Up Changes Check changes to parameter settings as a result of Auto-Tuning using the Verify function. Refer to Verifying Parameter Changes: Verify Menu on page 88. Save the verified parameter settings. Change the access level or set a password to the drive to prevent accidental modification of parameter settings. uBacking Up Parameter Values: o2-03 Performing the following procedure stores all parameters settings to drive memory where they can later be recalled if necessary. Set o2-03 to “1” to save parameter changes. This saves all parameter settings, and then returns o2-03 to 0. The drive can now “recall” the saved parameters by performing a “user-initialization” (A1-03 = 1110). No. Parameter Name DescriptionSetting']","['for continuous operation differs according to the lubrication method and motor manufacturer. If the motor is to be operated at a speed higher than the rated speed, consult with the manufacturer. Continuously operating an oil-lubricated motor in the low-speed range may result in burning.2.1 Section Safety 36 YASKAWA ELECTRIC SIEP C710606 18F YASKAWA AC Drive – V1000 Technical ManualNOTICE When the wiring distance is greater than 100 meters, pay special attention to the motor insulation voltage or use a drive-rated motor. Failure to comply could lead to motor winding failure. Motor vibration may increase when operating a machine in variable-speed mode, if that machine previously operated at a constant speed. Install vibration-proof rubber on the motor base or use the frequency jump function to skip a frequency resonating the machine. The motor may require more acceleration torque with drive operation than with a commercial power supply. Set a proper V/f pattern by checking the load torque characteristics of the machine to be used with the motor. The rated input current of submersible motors is higher than the rated input current of standard motors. Select an appropriate drive according to its rated output current. When the distance between the motor and drive is long, use a cable thick enough to connect the motor to the drive to prevent motor torque reduction. When using an explosion-proof motor, it must be subject to an explosion-proof test in conjunction with the drive. This']"
1,['What should be done when long motor cables cause nuisance tripping?'],"['Adjust the carrier frequency according to the table provided in C6-02: Carrier Frequency Selection on page 156, or reduce the ground currents by referring to Table 3.5 for cable length between drive and motor.']",['cable Length Between Drive and Motor'],['Separate the main circuit wiring and the control lines. nGround Fault Circuit Interrupter (GFCI) Trips During Run Cause Possible Solutions Excessive leakage current trips MCCB.• Increase the GFCI sensitivity or use GFCI with a higher threshold. •Lower the carrier frequency ( C6-02). • Reduce the length of the cable used between the drive and the motor. • Install a noise filter or reactor on the output side of the drive. nConnected Machinery Vibrates When Motor Rotates Excessive Motor Oscillation and Erratic Rotation Cause Possible Solution Poor balance between motor phases. Check drive input power voltage to ensure that it provides stable power. Unexpected Noise from Connected Machinery Cause Possible Solutions The carrier frequency is at the resonant frequency of the connected machinery.Adjust the carrier frequency using parameters C6-02 through C6-05. The drive output frequency is the same as the resonant frequency of the connected machinery.• Adjust the parameters used for the Jump Frequency function (d3-01 through d3-04) to skip the problem-causing bandwidth. • Place the motor on a rubber pad to reduce vibration. Note: The drive may have trouble assessing the status of the load due to white noise generated when using Swing PWM (C6-02 = 7 to A).6.9 Troubleshooting without Fault Display YASKAWA ELECTRIC SIEP C710606 18F YASKAWA AC Drive – V1000 Technical Manual 3056TroubleshootingnOscillation or Hunting Cause Possible Solutions Insufficient tuning in Open Loop Vector'],['263 6.4 FAULT DETECTION.............................................................................................267 6.5 ALARM DETECTION........................................................................................... 282 6.6 OPERATOR PROGRAMMING ERRORS............................................................ 291 6.7 AUTO-TUNING FAULT DETECTION .................................................................. 295 6.8 DIAGNOSING AND RESETTING FAULTS ......................................................... 298 6.9 TROUBLESHOOTING WITHOUT FAULT DISPLAY .......................................... 3006 YASKAWA ELECTRIC SIEP C710606 18F YASKAWA AC Drive – V1000 Technical Manual 2576.1 Section Safety DANGER Electrical Shock Hazard Do not connect or disconnect wiring while the power is on. Failure to comply will result in death or serious injury. WARNING Electrical Shock Hazard Do not operate equipment with covers removed. Failure to comply could result in death or serious injury. The diagrams in this section may illustrate drives without covers or safety shields to display details. Be sure to reinstall covers or shields before operating the drives and run the drives according to the instructions described in this manual. Always ground the motor-side grounding terminal. Improper equipment grounding could result in death or serious injury by contacting the motor case. Do not touch terminals before the capacitors have fully discharged. Failure to comply could result'],['could result in drive or equipment malfunction or nuisance trips. NOTICE: Use a class 2 power supply (UL standard) when connecting to the control terminals. Improper application of peripheral devices could result in drive performance degradation due to improper power supply. NOTICE: Insulate shields with tape or shrink tubing to prevent contact with other signal lines and equipment. Improper wiring practices could result in drive or equipment malfunction due to short circuit. NOTICE: Connect the shield of shielded cable to the appropriate ground terminal. Improper equipment grounding could result in drive or equipment malfunction or nuisance trips. Wire the control terminals using Figure 3.20 as a guide. Prepare the ends of the control circuit wiring as shown in Figure 3.21. Refer to Wire Size and Torque Specifications on page 66.3.7 Control Circuit Wiring 66 YASKAWA ELECTRIC SIEP C710606 18F YASKAWA AC Drive – V1000 Technical ManualNOTICE: Do not tighten screws beyond the specified tightening torque. Failure to comply may damage the terminal block. NOTICE: Use shielded twisted-pair cables as indicated to prevent operating faults. Improper wiring practices could result in drive or equipment malfunction due to electrical interference. Connect control wires as shown in the following figure: Preparing wire terminal endsEA BD C A – Control terminal block B– Avoid fraying wire strands when stripping insulation from wire. Strip length 5.5 mm. C – Single wire or stranded wireD –'],"['not connect phase-advancing capacitors or LC/RC noise filters to the output circuits. Improper application of noise filters could result in damage to the drive. NOTICE: Do not connect the AC power line to the output motor terminals of the drive. Failure to comply could result in death or serious injury by fire as a result of drive damage from line voltage application to output terminals. nCable Length Between Drive and Motor When the cable length between the drive and the motor is too long (especially at low frequency output), note that the cable voltage drop may cause reduced motor torque. Drive output current will increase as the leakage current from the cable increases. An increase in leakage current may trigger an overcurrent situation and weaken the accuracy of the current detection. Adjust the drive carrier frequency according to the following table. If the motor wiring distance exceeds 100 m because of the system configuration, reduce the ground currents. Refer to C6-02: Carrier Frequency Selection on page 156 Refer to Table 3.5 to set the carrier frequency to an appropriate level. Table 3.5 Cable Length Between Drive and Motor Cable Length 50 m or less 100 m or less Greater than 100 m Carrier Frequency 15 kHz or less 5 kHz or less 2 kHz or less Note: When setting carrier frequency, calculate the cable length as the total distance of wiring to all connected motors when running multiple motors from a single drive.3.6 Main Circuit Wiring YASKAWA ELECTRIC SIEP C710606']"
2,['Which parameter should be checked when the motor does not rotate properly?'],"['L7-01, L7-02']",['Troubleshooting'],"['proper direction. • The motor should accelerate and decelerate smoothly. nOperating the Motor under Loaded Conditions Test run the application similarly to the no-load test procedure when connecting the machinery to the motor. • Check monitor parameter U1-03 to ensure there is no overcurrent. • If the application permits running the load in the reverse direction, try changing motor direction and the frequency reference while watching for abnormal motor oscillation or vibration. • Correct any problems that occurs with hunting, oscillation, or other control-related issues.4.9 Test Run with Load Connected YASKAWA ELECTRIC SIEP C710606 18F YASKAWA AC Drive – V1000 Technical Manual 1094Start-Up Programming & Operation4.10 Verifying Parameter Settings and Backing Up Changes Check changes to parameter settings as a result of Auto-Tuning using the Verify function. Refer to Verifying Parameter Changes: Verify Menu on page 88. Save the verified parameter settings. Change the access level or set a password to the drive to prevent accidental modification of parameter settings. uBacking Up Parameter Values: o2-03 Performing the following procedure stores all parameters settings to drive memory where they can later be recalled if necessary. Set o2-03 to “1” to save parameter changes. This saves all parameter settings, and then returns o2-03 to 0. The drive can now “recall” the saved parameters by performing a “user-initialization” (A1-03 = 1110). No. Parameter Name DescriptionSetting']","['are outside the allowable parameter setting ranges. Digital Operator Display Fault Name Er-09 Acceleration Error (detected only during Rotational Auto-Tuning) Cause Possible Solution The motor did not accelerate for the specified acceleration time.• Increase the acceleration time (C1-01). • Check if it is possible to disconnect the machine from the motor. Torque limit when motoring is too low (L7-01 and L7-02).• Check the settings of parameters L7-01 and L7-02. • Increase the setting. Digital Operator Display Fault Name Er-11 Motor Speed Fault (detected only when Auto-Tuning is enabled) Cause Possible Solution Torque reference is too high. (Enabled in OLV only.)• Increase the acceleration time in C1-01. •Disconnect the machine from the motor, if possible. Digital Operator Display Fault Name Er-12 Current Detection Error Cause Possible Solution One of the motor phases is missing (U/T1, V/T2, W/T3).Check motor wiring and correct problems.6.7 Auto-Tuning Fault Detection 296 YASKAWA ELECTRIC SIEP C710606 18F YASKAWA AC Drive – V1000 Technical ManualDigital Operator Display Fault Name Current exceeded the current rating of the drive.• Check the motor wiring for a short between motor lines. •If a magnetic contactor is used between motors, ensure it is on. • Replace the drive. The current is too low. Attempted Auto-Tuning without motor connected to the drive.Connect the motor and perform Auto-Tuning. Current detection signal error. Replace the drive.6.7 Auto-Tuning Fault Detection']","['to stop while in Open Loop Vector Control. Cause Possible Solution Motor parameters are not set properly. Check the motor parameter settings and repeat Auto-Tuning. Torque limit is too low. Set the torque limit to the most appropriate setting (L7-01 through L7-04). Load inertia is too big.• Adjust the deceleration time (C1-02, -04, -06, -08). •Set the frequency to the minimum value and interrupt the run command when the drive finishes decelerating. Digital Operator Display Fault Name CoFCurrent Offset Fault The current sensor is damaged or there was residual induction current in the motor (e.g., during sudden deceleration or when coasting) when the drive attempted to start the motor. Cause Possible Solution6.4 Fault Detection YASKAWA ELECTRIC SIEP C710606 18F YASKAWA AC Drive – V1000 Technical Manual 2676TroubleshootingDigital Operator Display Fault Name Due to residual induction current in the motor when the drive attempted to start the motor, the drive attempted to adjust the current offset value beyond the allowable range.• Create a motor restart sequence that allows enough time for the residual induction voltage to dissipate. • Enable Speed Search at start (b3-01 = 1). Use the multi-function terminals to execute External Speed Search 1 and 2 (H1-oo = 61 or 62). Note: When using a PM motor, both External Speed Search 1 and 2 perform the same operation. Digital Operator Display Fault Name CPF02A/D Conversion Error An A/D conversion error occurred. Cause Possible Solution']","['Time) The response for torque compensation and slip compensation will drop as the time constant is increased. Auto-Tuning has not yet been performed (required for Open Loop Vector Control).Perform Auto-Tuning. Set motor parameters after calculating the proper values. Change the motor control method to V/f Control ( A1-02 = “0”). Insufficient tuning in V/f Control.Reduce the gain. •n1-02 (Hunting Prevention Gain Setting) • n1-03 (Hunting Prevention Time Constant Setting) Gain is too low when using PID control. Check the period of oscillation and adjust P, I, and D settings accordingly. The frequency reference is assigned to an external source and the signal is noisy.• Ensure that noise is not affecting the signal lines. •Separate main circuit wiring and control circuit wiring. • Use twisted-pair cables or shielded wiring for the control circuit. • Increase the analog input time filter constant (H3-13). The cable between the drive and motor is too long.• Perform Auto-Tuning. •Reduce the length of the cable. nPID Output Fault Cause Possible Solutions No PID feedback input.• Check the multi-function analog input terminal settings. • Set multi-function analog input terminal A1 or A2 for PID feedback (H3-02 or H3-10 = “B”). • A signal input to the terminal selection for PID feedback is necessary. • Check the connection of the feedback signal. • Check the various PID-related parameter settings. • No PID feedback input to the terminal causes the value detected to be 0, causing a PID']"
3,['What is the default setting for the parameter A1-03 (Initialize Parameters)?'],['2220'],['A: Initialization'],"['181 5.7 H: TERMINAL FUNCTIONS................................................................................. 184 5.8 L: PROTECTION FUNCTIONS ............................................................................ 213 5.9 N: SPECIAL ADJUSTMENTS.............................................................................. 240 5.10 O: OPERATOR RELATED SETTINGS ................................................................ 247 5.11 U: MONITOR PARAMETERS.............................................................................. 2545 YASKAWA ELECTRIC SIEP C710606 18F YASKAWA AC Drive – V1000 Technical Manual 1155.1 A: Initialization The initialization group contains parameters associated with initial setup of the drive. Parameters involving the display language, access levels, initialization, and password are located in this group. uA1: Initialization nA1-00: Language Selection Selects the display language for the digital operator. Note: This parameter is not reset when the drive is initialized using parameter A1-03. No. Parameter Name Setting Range Default A1-00 Language Selection 0 to 7 0 Setting 0: English Setting 1: Japanese Setting 2: German Setting 3: French Setting 4: Italian Setting 5: Spanish Setting 6: Portuguese Setting 7: Chinese nA1-01: Access Level Selection Allows or restricts access to drive parameters. No. Parameter Name Setting Range Default A1-01 Access Level Selection 0 to 2 2 Setting 0: Operation Only Access is restricted to parameters A1-01,']","['using A1-03 does not reset A1-07 to the factory default value. 3.For more information on DriveWorksEZ, contact a Yaskawa representative or the Yaskawa sales department directly. No. Parameter Name Setting Range Default A1-07 DriveWorksEZ Function Selection 0 to 2 0 Setting 0: DWEZ Disabled Setting 1: DWEZ Enabled Setting 2: Digital Input5.1 A: Initialization YASKAWA ELECTRIC SIEP C710606 18F YASKAWA AC Drive – V1000 Technical Manual 1195Parameter DetailsuA2: User Parameters nA2-01 to A2-32: User Parameters The user can select 32 parameters and assign them to A2-01 through A2-32. This saves time later scrolling through the parameter menu. The list of User Parameters can also track the most recently edited settings and save those parameters to this list. No. Parameter Name Setting Range Default A2-01 to A2-32 User Parameters 1 to 32 A1-02; b1-01 to o2-08Depending on A1-06 Saving User Parameters To save specific parameters to A2-01 to A2-32, first set the access level to allow access to all parameters (A1-02 = 2). Next assign the parameter number to the User Parameters list by entering it into one of the A2- oo parameters. By then setting A1-01 to “1”, the access level can be restricted so that users can only set and reference the specific parameters saved as User Parameters. nA2-33: User Parameter Automatic Selection A2-33 determines whether or not parameters that have been edited are saved to the User Parameters (A2-17 to A2-32) for quick, easy access. No. Parameter Name']","['will cause “APPL” to flash on the display in the Setup group and disable the up and down arrow keys on the digital operator. To fix this error, press the ESC key to return to the Setup group and then it will then be possible to switch to another mode using the up and down arrow keys. 2.A1-06 setting can only be changed by initializing the drive by first setting A1-03 to 2220. Setting A1-06 to a value that is out of range will not adversely affect drive operation. When the drive should not be initialized because initialization will cause other problems, then A1-06 does not need to be changed. WARNING! Confirm the drive I/O signals and external sequence before performing a test run. Setting parameter A1-06 may change the I/ O terminal function automatically from the default setting. Failure to comply may result in death or serious injury. No. Parameter Name Setting Range Default A1-06 Application Preset0: Disabled 1: Water supply pump 2: Conveyor 3: Exhaust fan 4: HVAC 5: Compressor <1> 8: Conveyor 2 <2>0 <1> Application Preset settings 6 and 7 are only available in drive software versions PRG: 5010, PRG: 1010, and PRG: 1011. To determine the drive software version, refer to the PRG: field on the drive nameplate or drive parameter U1-25. <2> Available in drive software versions PRG: 1020 and later. uSetting 1: Water Supply Pump Application Table 4.5 Water Supply Pump Parameter Settings No. Name Default Setting A1-02 Control Method Selection 0: V/f Control b1-04 Reverse']","['kW 7.5 kW 11 kW 15 kW 18 kW Rated Speed r/min 1150 1150 1150 1150 1150 1150 1150 1150 1150 1150 E5-02 Motor Rated Power kW 0.4 0.75 1.5 2.2 3.7 5.5 7.5 11 15 18.5 E5-03 Motor Rated Current A 1.88 3.02 6.00 8.85 14.27 20.21 26.67 39.9 55.6 63.5 E5-04 Motor Pole Number – 6 6 6 6 6 6 6 6 6 6 E5-05Motor Winding ResistanceΩ 4.832 2.704 1.114 0.511 0.412 0.303 0.165 0.113 0.084 0.066 E5-06 d-Axis Inductance mH 48.68 32.31 19.22 12.15 7.94 11.13 6.59 4.96 3.83 3.33 E5-07 q-Axis Inductance mH 63.21 40.24 24.38 15.35 11.86 14.06 8.55 6.12 4.65 4.5 E5-09Induction Voltage Constant 1mVs/rad 320.4 327.1 364.4 344.4 357.5 430.8 391.5 384.4 372.1 421.3 E5-24Induction Voltage Constant 2mV/(r/ min)0 0 0 0 0 0 0 0 0 0 E1-04Maximum Output FrequencyHz 57.5 57.5 57.5 57.5 57.5 57.5 57.5 57.5 57.5 57.5 E1-05Maximum Output VoltageV 190 190 190 190 190 190 190 190 190 190 E1-06 Base Frequency Hz 57.5 57.5 57.5 57.5 57.5 57.5 57.5 57.5 57.5 57.5 E1-09Minimum Output FrequencyHz 2.9 2.9 2.9 2.9 2.9 2.9 2.9 2.9 2.9 2.9 L3-24 <1>Motor Acceleration Time for Inertia Calculationss 0.062 0.044 0.08 0.09 0.067 0.072 0.088 0.073 0.062 0.091 n8-49d-Axis Current for High-Efficiency Control% –8.8 –9.9 –9.3 –10 –17.7 –12.3 –15.3 –13.9 –14.4 –17.9 <1> Default setting value is dependent on parameter o2-04, Drive Model Selection.B.6 Parameters that Change with the Motor Code Selection YASKAWA ELECTRIC SIEP C710606 18F YASKAWA AC Drive – V1000 Technical Manual 427BParameter ListnDrive Software Version PRG: 1017 and']"
