,Question,Answer,Source,Context_1,Context_2,Context_3,Context_4
16,['What should be checked if the motor will not accelerate properly?'],"['Increase the acceleration time (C1-01), Check if it is possible to disconnect the machine from the motor, Torque limit when motoring is too low (L7-01 and L7-02).']",['Digital Operator Display Fault Name Er-09 Acceleration Error'],"['situations. • Use Current Detection instead of Speed Estimation when operating motors smaller than 1.5 kW. Speed Estimation can end up stopping smaller motors as it might not be able to detect the speed or rotation direction of such small motors. • Use Short circuit Braking instead of Speed Estimation when using Open Loop Vector Control for PM motors along with a fairly long motor cable. • Use Short circuit Braking instead of Speed Estimation if attempting to find the speed of a motor coasting faster than 120 Hz in Open Loop Vector Control for PM motors. nCurrent Detection Type Speed Search (b3-24 = 0) Current Detection Speed Search can be applied to any motor. Be aware that sudden acceleration may occur when using Current Detection with relatively light loads. This method detects the motor speed by reducing the output frequency and measuring the current. The frequency reduction starts from the maximum output frequency or from the set frequency reference. As long as the output frequency is higher than the rotor speed, the slip will cause a high current. The closer the output frequency comes to the rotor speed, the lower the current draw will be. When the output current drops below the level as set in b3-02, the output frequency stops decreasing and normal operation resumes. The following time chart illustrates how Current Detection Speed Search operates after a momentary power loss:5.2 b: Application YASKAWA ELECTRIC SIEP C710606 18F YASKAWA AC Drive – V1000 Technical Manual']","['are outside the allowable parameter setting ranges. Digital Operator Display Fault Name Er-09 Acceleration Error (detected only during Rotational Auto-Tuning) Cause Possible Solution The motor did not accelerate for the specified acceleration time.• Increase the acceleration time (C1-01). • Check if it is possible to disconnect the machine from the motor. Torque limit when motoring is too low (L7-01 and L7-02).• Check the settings of parameters L7-01 and L7-02. • Increase the setting. Digital Operator Display Fault Name Er-11 Motor Speed Fault (detected only when Auto-Tuning is enabled) Cause Possible Solution Torque reference is too high. (Enabled in OLV only.)• Increase the acceleration time in C1-01. •Disconnect the machine from the motor, if possible. Digital Operator Display Fault Name Er-12 Current Detection Error Cause Possible Solution One of the motor phases is missing (U/T1, V/T2, W/T3).Check motor wiring and correct problems.6.7 Auto-Tuning Fault Detection 296 YASKAWA ELECTRIC SIEP C710606 18F YASKAWA AC Drive – V1000 Technical ManualDigital Operator Display Fault Name Current exceeded the current rating of the drive.• Check the motor wiring for a short between motor lines. •If a magnetic contactor is used between motors, ensure it is on. • Replace the drive. The current is too low. Attempted Auto-Tuning without motor connected to the drive.Connect the motor and perform Auto-Tuning. Current detection signal error. Replace the drive.6.7 Auto-Tuning Fault Detection']","['occur too frequently. nUnstable Motor Speed when Using PM or IPM Cause Possible Solutions The motor code for PM (E5-01) is set incorrectly. (Yaskawa motors only)Set parameter E5-01 in accordance with the motor being used. The drive is operating at less than 10% of the speed reference.Consult with Yaskawa about using a different type of motor when attempting to operate at 10% of the speed reference. Motor hunting occurs.Set and carefully adjust the following parameters in the order listed: •n8-45 (Speed Feedback Detection Suppression Gain) • n8-55 (Load Inertia for PM Motors) • C4-02 (Torque Compensation Primary Delay Time) Hunting occurs at start. Increase the S-curve time at the start of acceleration (C2-01). Too much current is flowing through the drive.• If using a PM motor, set the correct motor code to E5-01. •If using a specialized motor, set parameter E5-xx to the correct value according to the Motor Test Report. nMotor Does Not Operate When the RUN Button on the Digital Operator is Pressed Cause Possible Solutions The LOCAL/REMOTE mode is not selected properly. Press the LOCAL/REMOTE button to switch. The LO/RE LED should be on for LOCAL mode. The drive is not in drive mode. A run command will not be issued. Exit to the drive mode and cycle the run command. The frequency reference is too low.• If the frequency reference is set below the frequency set in E1-09 (Minimum Output Frequency), the drive will not operate. •Raise the frequency reference to at least the']","['to stop while in Open Loop Vector Control. Cause Possible Solution Motor parameters are not set properly. Check the motor parameter settings and repeat Auto-Tuning. Torque limit is too low. Set the torque limit to the most appropriate setting (L7-01 through L7-04). Load inertia is too big.• Adjust the deceleration time (C1-02, -04, -06, -08). •Set the frequency to the minimum value and interrupt the run command when the drive finishes decelerating. Digital Operator Display Fault Name CoFCurrent Offset Fault The current sensor is damaged or there was residual induction current in the motor (e.g., during sudden deceleration or when coasting) when the drive attempted to start the motor. Cause Possible Solution6.4 Fault Detection YASKAWA ELECTRIC SIEP C710606 18F YASKAWA AC Drive – V1000 Technical Manual 2676TroubleshootingDigital Operator Display Fault Name Due to residual induction current in the motor when the drive attempted to start the motor, the drive attempted to adjust the current offset value beyond the allowable range.• Create a motor restart sequence that allows enough time for the residual induction voltage to dissipate. • Enable Speed Search at start (b3-01 = 1). Use the multi-function terminals to execute External Speed Search 1 and 2 (H1-oo = 61 or 62). Note: When using a PM motor, both External Speed Search 1 and 2 perform the same operation. Digital Operator Display Fault Name CPF02A/D Conversion Error An A/D conversion error occurred. Cause Possible Solution']"
17,['What is the function of parameter o2-03?'],['Stores user settings when parameter o2-03 = ‘1: Set Defaults’.'],['Notes on Parameter Initialization'],"['parameters are returned to the values selected as user settings. User settings are stored when parameter o2-03 = “1: Set Defaults”. Note: A “user-initialization” resets all parameters to a user-defined set of default values that were previously saved to the drive. To clear the user- defined default values, set parameter o2-03 to “2”. Setting 2220: 2-Wire Initialization Resets all parameters back to their original default settings with digital inputs S1 and S2 configured as forward run and reverse run, respectively. A 2-wire sequence assigns functions to input terminals S1 and S2. Refer to Setting 40/41: Forward Run/Reverse Run Command for 2-Wire Sequence on page 191 for more information. Setting 3330: 3-Wire Initialization The drive parameters are returned to factory default values with digital inputs S1, S2, and S5 configured as run, stop, and forward/reverse respectively. A 3-wire sequence assigns functions to input terminals S1, S2, and S5. Refer to Setting 0: 3-Wire Sequence on page 185 for more information. Setting 5550: oPE04 Reset If parameters on a certain drive have been edited and then a different terminal block is installed with different settings saved in its built-in memory, an oPE04 error will appear on the display. To use the parameter settings saved to the terminal block memory, set A1-03 to “5550”. Notes on Parameter Initialization The parameters shown in Table 5.1 will not be reset when the drive is initialized by setting A1-03 = 2220 or 3330. The fault']","['Verify the parameter settings to and from the drive. no3-01: Copy Function Selection This parameter controls the copying of parameters to and from the LED operator (option). The copy function will change certain parameter default settings depending on the regional specification of the drive. No. Name Setting Range Default o3-01 Copy Function Selection 0 to 3 0 0: COPY SELECT (no function) 1: INV --> OP READ All parameters are copied from the drive to the digital operator. Note: Set o3-02 to 1 to unlock copy protection. 2: OP --> INV WRITE All parameters are copied from the digital operator to the drive. 3: OP<-->INV VERIFY Parameter settings in the drive are compared to those in the digital operator. Note: When using the copy function, the drive model number (o2-04) and the software number (U1-14) must match or an error will occur. no3-02 Copy Allowed Selection Enables and disables the digital operator copy functions.5.10 o: Operator Related Settings 250 YASKAWA ELECTRIC SIEP C710606 18F YASKAWA AC Drive – V1000 Technical ManualNo. Name Setting Range Default o3-02 Copy Allowed Selection 0, 1 0 0: Disabled No digital operator copy functions are allowed 1: Enabled Copying allowed uo4: Maintenance Monitor Settings no4-01: Accumulated Operation Time Setting Parameter o4-01 sets the cumulative operation time and allows the user to set the starting value of the accumulated operation time displayed in monitor U4-01. Note: The value in o4-01 is set in 10 h units. For example, a']","['Analog Frequency Reference Sample/Hold An oPE03 error will occur when one of the following functions is used simultaneously with the Analog Frequency Reference Sample/Hold function. •Hold Accel/Decel Stop (setting: A) • Up command, Down command (setting: 10, 11) • Offset Frequency (setting: 44 to 46) • Up or Down functions (setting: 75, 76) Setting 20 to 2F: External Fault By using the External Fault function, the drive can be stopped when problems occur with external devices. To use the external fault function, set one of the multi-function digital inputs to any value between 20 to 2F. The operator will display EFo where o is the number of the terminal (terminal S o) to which the external fault signal is assigned. For example, if an external fault signal is input to terminal S3, “EF3” will be displayed. Select the value to be set in H1- oo from a combination of any of the following three conditions: • Signal input level from peripheral devices (N.O./N.C.) • External fault detection method • Operation after external fault detection The following table shows the relationship between the conditions and the value set to H1- oo: SettingTerminal Status <1>Detection Method <2> Stopping Method N.O. N.C.Always DetectedDetected during Run onlyRamp to Stop (fault)Coast to Stop (fault)Fast-stop (fault)Alarm Only (continue running) 20 O O O 21 O O O 22 O O O 23 O O O 24 O O O 25 O O O 26 O O O 27 O O O 28 O O O 29 O O O 2A O O O 2B O O O 5.7 H: Terminal Functions 190 YASKAWA ELECTRIC']","['Solution The drive capacity setting (o2-04) and the actual capacity of the drive are not the same.Correct the value set to o2-04. Digital Operator Display Fault Name oPE02Parameter Range Setting Error Use U1-18 to find parameters set outside the range. Cause Possible Solution Parameters were set outside the possible setting range.Set parameters to the proper values. Note: Other errors are given precedence over oPE02 when multiple errors occur at the same time. Digital Operator Display Fault Name oPE03Multi-Function Input Selection Error A contradictory setting is assigned to multi-function contact inputs H1-01 to H1-07. Cause Possible Solution • The same function is assigned to two multi-function inputs. •Excludes “Not used” and “External Fault.”•Ensure all multi-function inputs are assigned to different functions. • Re-enter the multi-function settings to ensure this does not occur. The Up command was set but the Down command was not, or vice versa (settings 10 vs. 11).Correctly set functions that need to be enabled in combination with other functions.The Up 2 command was set but the Down 2 command was not, or vice versa (settings 75 vs. 76). • Run/Stop command for a 2-Wire sequence 2 was set (H1-oo = 42), but forward/ reverse command (H1- oo = 43) was not. •“Drive Enable” is set to multi-function input S1 or S2 (H1-01 = 6A or H1-02 = 6A).Correctly set functions that need to be enabled in combination with other functions. Two of the following functions are set at the same']"
18,['Which function provides protection from ground faults during operation?'],['Output Ground Fault Detection'],['5.8 L: Protection Functions'],['fault (LF) is triggered when one output phase is lost. The output shuts off and the motor coasts to stop.5.8 L: Protection Functions 236 YASKAWA ELECTRIC SIEP C710606 18F YASKAWA AC Drive – V1000 Technical ManualSetting 2: Fault when Two Phases are Lost An output phase loss fault (LF) is triggered when two output phases are lost. The output shuts off and the motor coasts to stop. nL8-09: Output Ground Fault Detection Selection Enables or disables the output ground fault detection. No. Name Setting Range Default L8-09 Output Ground Fault Detection 0 or 1 1 Setting 0: Disabled Ground faults are not detected. Setting 1: Enabled A ground fault (GF) is triggered when high leakage current or a ground short circuit occurs in one or two output phases. nL8-10: Heatsink Cooling Fan Operation Selection Selects the heatsink cooling fan operation. No. Name Setting Range Default L8-10 Fan Operation Selection 0 or 1 0 Setting 0: Run with Timer The fan is switched on when a Run command is active. It is switched off with the delay set in parameter L8-11 after the Run command has been released. Using this setting extends the fan lifetime. Setting 1: Run always The fan runs whenever power is supplied to the drive. nL8-11: Heatsink Cooling Fan Off Delay Time Sets the cooling fan switch off delay time if parameter L8-10 is set to 0. No. Name Setting Range Default L8-11 Cooling Fan Switch Off Delay 0 to 300 s 60 s nL8-12: Ambient Temperature Setting If the temperature where the drive is mounted'],"['with the feedback sensor. Check the sensor on the controller side. If damaged, replace the sensor. Digital Operator Display Fault Name GFGround Fault • Current shorted to ground exceeded 50% of rated current on output side of the drive. • Setting L8-09 to 1 enables ground fault detection in models 2A0020 to 2A0069 and 4A0011 to 4A0038. Cause Possible Solution Motor insulation is damaged.• Check the insulation resistance of the motor. • Replace the motor.6.4 Fault Detection YASKAWA ELECTRIC SIEP C710606 18F YASKAWA AC Drive – V1000 Technical Manual 2716TroubleshootingDigital Operator Display Fault Name A damaged motor cable is creating a short circuit.• Check the motor cable. •Remove the short circuit and turn the power back on. • Check the resistance between the cable and the ground terminal . •Replace the cable. The leakage current at the drive output is too high.• Reduce the carrier frequency. • Reduce the amount of stray capacitance. The drive started to run during Current Offset Fault or while coasting to a stop.• The value set exceeds the allowable setting range while the drive automatically adjusts the current offset (this happens only attempting to restart a PM motor that is coasting to stop). • Enable Speed Search at start (b3-01 = 1). •Perform Speed Search 1 or 2 (H1-oo = 61 or 62) via one of the external terminals. Note: Speed Search 1 and 2 are the same when using OLV/PM control mode. Hardware problem. • Replace the drive. Digital Operator Display Fault Name']","['Analog Frequency Reference Sample/Hold An oPE03 error will occur when one of the following functions is used simultaneously with the Analog Frequency Reference Sample/Hold function. •Hold Accel/Decel Stop (setting: A) • Up command, Down command (setting: 10, 11) • Offset Frequency (setting: 44 to 46) • Up or Down functions (setting: 75, 76) Setting 20 to 2F: External Fault By using the External Fault function, the drive can be stopped when problems occur with external devices. To use the external fault function, set one of the multi-function digital inputs to any value between 20 to 2F. The operator will display EFo where o is the number of the terminal (terminal S o) to which the external fault signal is assigned. For example, if an external fault signal is input to terminal S3, “EF3” will be displayed. Select the value to be set in H1- oo from a combination of any of the following three conditions: • Signal input level from peripheral devices (N.O./N.C.) • External fault detection method • Operation after external fault detection The following table shows the relationship between the conditions and the value set to H1- oo: SettingTerminal Status <1>Detection Method <2> Stopping Method N.O. N.C.Always DetectedDetected during Run onlyRamp to Stop (fault)Coast to Stop (fault)Fast-stop (fault)Alarm Only (continue running) 20 O O O 21 O O O 22 O O O 23 O O O 24 O O O 25 O O O 26 O O O 27 O O O 28 O O O 29 O O O 2A O O O 2B O O O 5.7 H: Terminal Functions 190 YASKAWA ELECTRIC']","['exceeds (overtorque detection) or is below (undertorque detection) the torque value set in parameter L6-05 for longer than the time specified in parameter L6-06. Setting C: Frequency Reference Loss An output set for this function will be closed if frequency reference loss is detected. Refer to L4-05: Frequency Reference Loss Detection Selection on page 227 for details. Setting D: Dynamic Braking Resistor Overheat An output programmed for this function will close when the dynamic braking resistor (DB) overheats or the braking transistor is in a fault condition. Setting E: Fault The Fault configured digital output will close whenever the drive experiences a fault (this excludes faults CPF00 and CPF01). Setting F: Not Used Use this setting when the terminal is not used or when using the terminal as a throughput. When set to “F”, the output is not set by any drive function but it can be switched by a PLC via a communication option or MEMOBUS/Modbus communications (through mode). Setting 10: Minor Fault Output closes when a minor fault condition is present. Setting 11: Reset Command Active Output closes whenever there is an attempt to reset a fault situation from the control circuit terminals, via serial communications, or using a communications option card. Setting 12: Timer Output This setting configures a digital output terminal as output for the timer function. Refer to b4: Delay Timers on page 135 for details. Setting 13: Speed Agree 2 (f ref /fout Agree 2) Closes whenever']"
19,['How can a user switch between LOCAL and REMOTE operation using terminals?'],['Set the corresponding parameter H1-01 through H1-07 to 1 using one of the digital input terminals S1 through S7.'],['nUsing Input Terminals S1 through S7 to Switch between LO/RE'],"['original default settings. Scroll through the list by pressing the key. 4.Press the key until C1-01 appears. 5.Press the key to access the setting value. (number farthest to the left flashes) uSwitching Between LOCAL and REMOTE Entering the run command using the LED operator is referred to as LOCAL, while entering the run command from an external device via the control circuit terminals or network option is referred to as REMOTE. WARNING! Sudden Movement Hazard. The drive may start unexpectedly if the Run command is already applied when switching from LOCAL mode to REMOTE mode when b1-07 = 1, resulting in death or serious injury. Be sure all personnel are clear of rotating machinery and electrical connections prior to switching between LOCAL mode and REMOTE mode. There are two ways to switch between LOCAL and REMOTE. Note: 1. After selecting LOCAL, the LO/RE light will remain lit.4.3 The Drive and Programming Modes 88 YASKAWA ELECTRIC SIEP C710606 18F YASKAWA AC Drive – V1000 Technical Manual2.The drive will not allow the user to switch between LOCAL and REMOTE during run. nUsing the LO/RE Key on the LED Operator Step Display/Result 1.Turn on the power to the drive. The initial display appears. 2.Press . The LO/RE light will light up. The drive is now in Local. To set the drive for REMOTE operation, press the key again.STOP nUsing Input Terminals S1 through S7 to Switch between LO/RE Switch between LOCAL and REMOTE using one of the digital input terminals S1 through S7 (set']","['Run command active at power up). When initializing the drive use 3-Wire initialization. Failure to comply could result in death or serious injury from moving equipment. Setting 1: LOCAL/REMOTE Selection This setting allows the input terminal to determine if the drive will run in LOCAL mode or REMOTE mode. Status Description Closed LOCAL: Frequency reference and Run command are input from the digital operator. OpenREMOTE: Frequency reference and Run command are input from the selected external reference in accordance with the b1-01 and b1-02 or b1-15 and b1-16 settings. Note: 1. If one of the multi-function input terminals is set to for LOCAL/REMOTE, then the LO/RE key on the operator will be disabled. 2.When the drive is set to LOCAL, the LO/RE LED will light. 3.The default setting of the drive is not to allow switching between LOCAL and REMOTE during run. to Refer to b1-07: LOCAL/ REMOTE Run Selection on page 127 if this feature is required by the application.5.7 H: Terminal Functions YASKAWA ELECTRIC SIEP C710606 18F YASKAWA AC Drive – V1000 Technical Manual 1855Parameter DetailsSetting 2: External Reference 1/2 Selection The external reference 1/external reference 2 selection function allows the user to switch between the frequency reference and Run command source between external reference 1 and 2. Status Description Open External reference 1 is used (defined by parameters b1-01 and b1-02) Closed External reference 2 is used (defined by parameters b1-15 and b1-16) Note:']","['Refer to Setting 1: LOCAL/REMOTE Selection on page 185, Refer to Setting 2: External Reference 1/2 Selection on page 186 and Refer to o2-01: LO/RE (LOCAL/REMOTE) Key Function Selection on page 248): • LOCAL - The digital operator is used to set the reference and the Run command. • REMOTE -Reference 1: The settings of b1-01 and b1-02 determine where the frequency reference and Run command are input from. • REMOTE - Reference 2: The settings of b1-15 and b1-16 determine where the frequency reference and Run command are input from. When switching from LOCAL to REMOTE, or between Reference 1 and Reference 2, the Run command may already be present at the location the source was switched to. Parameter b1-07 can be used to determine how the Run command is treated in this case. No. Parameter Name Setting Range Default b1-07 LOCAL/REMOTE Run Selection 0 or 1 0 Setting 0: Run Command Must Be Cycled If the Run command is issued differently in the old and new control source (e.g. old - terminals, new - serial communications) and it is active at the new source when switching takes place, the drive will either not start or it will stop if it was running before. The Run command has to be cycled to start from the new control source. Setting 1: Continue Running If the Run command is active at the new control source, the drive starts or continues running. There is no need to cycle the Run command. WARNING! The drive may start unexpectedly if switching control sources when b1-07 = 1. Clear all']","['Drive and Programming Modes 88 YASKAWA ELECTRIC SIEP C710606 18F YASKAWA AC Drive – V1000 Technical Manual2.The drive will not allow the user to switch between LOCAL and REMOTE during run. nUsing the LO/RE Key on the LED Operator Step Display/Result 1.Turn on the power to the drive. The initial display appears. 2.Press . The LO/RE light will light up. The drive is now in Local. To set the drive for REMOTE operation, press the key again.STOP nUsing Input Terminals S1 through S7 to Switch between LO/RE Switch between LOCAL and REMOTE using one of the digital input terminals S1 through S7 (set the corresponding parameter H1-01 through H1-07 to 1). Follow the example below to set the digital input terminals. Note: 1. Refer to Parameter List on page 353 for a list of digital input selections. 2.Setting a multi-function input terminal to a value of 1 disables the LO/RE key on the LED operator. uParameters Available in the Setup Group nSetup Mode (STUP) Parameters used for this drive are classified into A to U. To simplify the drive setup, frequently used parameters are selected and input into Setup Mode. 1.To set a parameter, the Setup Mode must be displayed first. Press the Up/Down key until is displayed. 2.Select the parameter and change the setting. Table 4.4 lists parameters available in the Setup group. If the desired parameter cannot be set in the Setup mode, use the Parameter Setting mode. Note: 1.When parameter A1-02 (Control Method Selection) is changed, some parameter']"
