,Question,Answer,Source,Context_1,Context_2,Context_3,Context_4
28,['What is the default setting for parameter A1-01?'],['2'],['5.1 A: Initialization'],"['181 5.7 H: TERMINAL FUNCTIONS................................................................................. 184 5.8 L: PROTECTION FUNCTIONS ............................................................................ 213 5.9 N: SPECIAL ADJUSTMENTS.............................................................................. 240 5.10 O: OPERATOR RELATED SETTINGS ................................................................ 247 5.11 U: MONITOR PARAMETERS.............................................................................. 2545 YASKAWA ELECTRIC SIEP C710606 18F YASKAWA AC Drive – V1000 Technical Manual 1155.1 A: Initialization The initialization group contains parameters associated with initial setup of the drive. Parameters involving the display language, access levels, initialization, and password are located in this group. uA1: Initialization nA1-00: Language Selection Selects the display language for the digital operator. Note: This parameter is not reset when the drive is initialized using parameter A1-03. No. Parameter Name Setting Range Default A1-00 Language Selection 0 to 7 0 Setting 0: English Setting 1: Japanese Setting 2: German Setting 3: French Setting 4: Italian Setting 5: Spanish Setting 6: Portuguese Setting 7: Chinese nA1-01: Access Level Selection Allows or restricts access to drive parameters. No. Parameter Name Setting Range Default A1-01 Access Level Selection 0 to 2 2 Setting 0: Operation Only Access is restricted to parameters A1-01,']","['102 Auto-Tuning Interruption and Fault Codes ...................................................................................... 103 Performing Auto-Tuning .................................................................................................................. 103 Auto-Tuning Example...................................................................................................................... 105 Input Data for Auto-Tuning.............................................................................................................. 106 4.8 No-Load Operation Test Run............................................................................................108 No-Load Operation Test Run .......................................................................................................... 108 4.9 Test Run with Load Connected........................................................................................109 Test Run with the Load Connected................................................................................................. 109 4.10 Verifying Parameter Settings and Backing Up Changes...............................................110 Backing Up Parameter Values: o2-03............................................................................................. 110 Parameter Access Level: A1-01...................................................................................................... 110 Password Settings: A1-04, A1-05']","['using A1-03 does not reset A1-07 to the factory default value. 3.For more information on DriveWorksEZ, contact a Yaskawa representative or the Yaskawa sales department directly. No. Parameter Name Setting Range Default A1-07 DriveWorksEZ Function Selection 0 to 2 0 Setting 0: DWEZ Disabled Setting 1: DWEZ Enabled Setting 2: Digital Input5.1 A: Initialization YASKAWA ELECTRIC SIEP C710606 18F YASKAWA AC Drive – V1000 Technical Manual 1195Parameter DetailsuA2: User Parameters nA2-01 to A2-32: User Parameters The user can select 32 parameters and assign them to A2-01 through A2-32. This saves time later scrolling through the parameter menu. The list of User Parameters can also track the most recently edited settings and save those parameters to this list. No. Parameter Name Setting Range Default A2-01 to A2-32 User Parameters 1 to 32 A1-02; b1-01 to o2-08Depending on A1-06 Saving User Parameters To save specific parameters to A2-01 to A2-32, first set the access level to allow access to all parameters (A1-02 = 2). Next assign the parameter number to the User Parameters list by entering it into one of the A2- oo parameters. By then setting A1-01 to “1”, the access level can be restricted so that users can only set and reference the specific parameters saved as User Parameters. nA2-33: User Parameter Automatic Selection A2-33 determines whether or not parameters that have been edited are saved to the User Parameters (A2-17 to A2-32) for quick, easy access. No. Parameter Name']","['kW 7.5 kW 11 kW 15 kW 18 kW Rated Speed r/min 1150 1150 1150 1150 1150 1150 1150 1150 1150 1150 E5-02 Motor Rated Power kW 0.4 0.75 1.5 2.2 3.7 5.5 7.5 11 15 18.5 E5-03 Motor Rated Current A 1.88 3.02 6.00 8.85 14.27 20.21 26.67 39.9 55.6 63.5 E5-04 Motor Pole Number – 6 6 6 6 6 6 6 6 6 6 E5-05Motor Winding ResistanceΩ 4.832 2.704 1.114 0.511 0.412 0.303 0.165 0.113 0.084 0.066 E5-06 d-Axis Inductance mH 48.68 32.31 19.22 12.15 7.94 11.13 6.59 4.96 3.83 3.33 E5-07 q-Axis Inductance mH 63.21 40.24 24.38 15.35 11.86 14.06 8.55 6.12 4.65 4.5 E5-09Induction Voltage Constant 1mVs/rad 320.4 327.1 364.4 344.4 357.5 430.8 391.5 384.4 372.1 421.3 E5-24Induction Voltage Constant 2mV/(r/ min)0 0 0 0 0 0 0 0 0 0 E1-04Maximum Output FrequencyHz 57.5 57.5 57.5 57.5 57.5 57.5 57.5 57.5 57.5 57.5 E1-05Maximum Output VoltageV 190 190 190 190 190 190 190 190 190 190 E1-06 Base Frequency Hz 57.5 57.5 57.5 57.5 57.5 57.5 57.5 57.5 57.5 57.5 E1-09Minimum Output FrequencyHz 2.9 2.9 2.9 2.9 2.9 2.9 2.9 2.9 2.9 2.9 L3-24 <1>Motor Acceleration Time for Inertia Calculationss 0.062 0.044 0.08 0.09 0.067 0.072 0.088 0.073 0.062 0.091 n8-49d-Axis Current for High-Efficiency Control% –8.8 –9.9 –9.3 –10 –17.7 –12.3 –15.3 –13.9 –14.4 –17.9 <1> Default setting value is dependent on parameter o2-04, Drive Model Selection.B.6 Parameters that Change with the Motor Code Selection YASKAWA ELECTRIC SIEP C710606 18F YASKAWA AC Drive – V1000 Technical Manual 427BParameter ListnDrive Software Version PRG: 1017 and']"
29,['What happens when the STOP button is pressed in REMOTE mode?'],"['If operation has been interrupted by pressing the STOP key, the Run command must be cycled to restart the drive.']",['no2-03: User Parameter Default Value and nUsing the LO/RE Key on the LED Operator Step Display/Result'],"['LED indicator on the LO/RE key will light up. WARNING! Sudden Movement Hazard. The drive may start unexpectedly if the Run command is already applied when switching from LOCAL mode to REMOTE mode when b1-07 = 1, resulting in death or serious injury. Be sure all personnel are clear of rotating machinery and electrical connections prior to switching between LOCAL mode and REMOTE mode. no2-02: STOP Key Function Selection Selects if the STOP key on the digital operator can be used to stop the operation when the drive is controlled from a remote source (i.e., not from digital operator). No. Name Setting Range Default o2-02 STOP Key Function Selection 0 or 1 15.10 o: Operator Related Settings 248 YASKAWA ELECTRIC SIEP C710606 18F YASKAWA AC Drive – V1000 Technical ManualSetting 0: Disabled The STOP key has no function when the drive is controlled by a source other than the digital operator. The drive can only be stopped from the Run command source that has been selected. Setting 1: Enabled The STOP key can be used to terminate the operation, even if the Run command source is not assigned to the digital operator. If operation has been interrupted by pressing the STOP key, the Run command must be cycled to restart the drive. no2-03: User Parameter Default Value Once drive parameters are set up completely, the values set can be saved as “User Initialization Values” by setting parameter o2-03. Once this has been done, the “Initialize Parameters” parameter (A1-03) will offer the choice']","['original default settings. Scroll through the list by pressing the key. 4.Press the key until C1-01 appears. 5.Press the key to access the setting value. (number farthest to the left flashes) uSwitching Between LOCAL and REMOTE Entering the run command using the LED operator is referred to as LOCAL, while entering the run command from an external device via the control circuit terminals or network option is referred to as REMOTE. WARNING! Sudden Movement Hazard. The drive may start unexpectedly if the Run command is already applied when switching from LOCAL mode to REMOTE mode when b1-07 = 1, resulting in death or serious injury. Be sure all personnel are clear of rotating machinery and electrical connections prior to switching between LOCAL mode and REMOTE mode. There are two ways to switch between LOCAL and REMOTE. Note: 1. After selecting LOCAL, the LO/RE light will remain lit.4.3 The Drive and Programming Modes 88 YASKAWA ELECTRIC SIEP C710606 18F YASKAWA AC Drive – V1000 Technical Manual2.The drive will not allow the user to switch between LOCAL and REMOTE during run. nUsing the LO/RE Key on the LED Operator Step Display/Result 1.Turn on the power to the drive. The initial display appears. 2.Press . The LO/RE light will light up. The drive is now in Local. To set the drive for REMOTE operation, press the key again.STOP nUsing Input Terminals S1 through S7 to Switch between LO/RE Switch between LOCAL and REMOTE using one of the digital input terminals S1 through S7 (set']","['of Auto-Tuning. The Verify Menu helps determine which settings have been changed, and is particularly useful when replacing a drive. If no settings have been changed, the Verify Menu will read . The Verify menu also allows users to access and re-edit previously edited parameters. Note: The Verify Menu will not display A1- oo parameters (except for A1-02), nor will it display parameters A2-01 to A2-32 or E5-01 even if those parameters have been changed from default settings. The following example is a continuation of the steps beginning on page 88. Here, parameter C1-01 is accessed using the Verify Menu and is changed again to 20.0 s. To check the list of edited parameters: Step Display/Result 1. Turn on the power to the drive. The initial display appears. 2.Press until the display shows the “Verify” representation. 3.Press to enter the list of parameters that have been edited from their original default settings. Scroll through the list by pressing the key. 4.Press the key until C1-01 appears. 5.Press the key to access the setting value. (number farthest to the left flashes) uSwitching Between LOCAL and REMOTE Entering the run command using the LED operator is referred to as LOCAL, while entering the run command from an external device via the control circuit terminals or network option is referred to as REMOTE. WARNING! Sudden Movement Hazard. The drive may start unexpectedly if the Run command is already applied when switching from LOCAL mode to REMOTE mode when b1-07 = 1,']","['types and sizes. Table 3.9 Wire Size and Torque Specifications (Same for All Models) TerminalScrew SizeTightening Torque N•m (in-lbs)Bare Wire Terminal Ferrule-Type Terminal Applic. wire size mm2 (AWG)Recomm. mm2 (AWG)Applic. wire size mm2 (AWG)Recomm. mm2 (AWG)Wire Type MA, MB, MC M30.5 to 0.6 (4.4 to 5.3)Stranded: 0.25 to 1.5 (24 to 16) Single: 0.25 to 1.5 (24 to 16)0.75 (18)0.25 to 1.0 (24 to 17)0.5 (20) Shielded line, etc.S1-S7, SC, RP, +V, A1, A2, AC, HC, H1, P1, P2, PC, MP, AM, AC, S+, S-, R+, R-, IGM20.22 to 0.25 (1.9 to 2.2)Stranded: 0.25 to 1.0 (24 to 18) Single: 0.25 to 1.5 (24 to 16)0.75 (18)0.25 to 0.5 (24 to 20)0.5 (20) nFerrule-Type Wire Terminations Crimp a ferrule to signal wiring to improve wiring simplicity and reliability. Use CRIMPFOX 6, a crimping tool manufactured by PHOENIX CONTACT. d1 d2 6 mm L Figure 3.19 Ferrule Dimensions Table 3.10 Ferrule Terminal Types and Sizes Size mm2 (AWG) Type L (mm) d1 (mm) d2 (mm) Manufacturer 0.25 (24) AI 0.25-6YE 10.5 0.8 2.0 PHOENIX CONTACT0.34 (22) AI 0.34-6TQ 10.5 0.8 2.0 0.5 (20) AI 0.5-6WH 12 1.1 2.5 0.75 (18) AI 0.75-6GY 12 1.3 2.8 1.0 AI 1-6RD 12 1.5 3.0 uWiring Procedure This section describes the proper procedures and preparations for wiring the control terminals. WARNING! Electrical Shock Hazard. Do not remove covers or touch the circuit boards while the power is on. Failure to comply could result in death or serious injury. NOTICE: Separate control circuit wiring from main circuit wiring (terminals R/L1,']"
30,['What should be done if the motor hunting occurs in Open Loop Vector Control?'],"['Adjust C4-02 (Torque Compensation Primary Delay Time), n2-01 (Speed Feedback Detection Control [AFR] Time Constant 1) and C3-02 (Slip Compensation Primary Delay Time) in order, or Perform Auto-Tuning.']",['Insufficient tuning in Open Loop Vector Control'],"['Time) The response for torque compensation and slip compensation will drop as the time constant is increased. Auto-Tuning has not yet been performed (required for Open Loop Vector Control).Perform Auto-Tuning. Set motor parameters after calculating the proper values. Change the motor control method to V/f Control ( A1-02 = “0”). Insufficient tuning in V/f Control.Reduce the gain. •n1-02 (Hunting Prevention Gain Setting) • n1-03 (Hunting Prevention Time Constant Setting) Gain is too low when using PID control. Check the period of oscillation and adjust P, I, and D settings accordingly. The frequency reference is assigned to an external source and the signal is noisy.• Ensure that noise is not affecting the signal lines. •Separate main circuit wiring and control circuit wiring. • Use twisted-pair cables or shielded wiring for the control circuit. • Increase the analog input time filter constant (H3-13). The cable between the drive and motor is too long.• Perform Auto-Tuning. •Reduce the length of the cable. nPID Output Fault Cause Possible Solutions No PID feedback input.• Check the multi-function analog input terminal settings. • Set multi-function analog input terminal A1 or A2 for PID feedback (H3-02 or H3-10 = “B”). • A signal input to the terminal selection for PID feedback is necessary. • Check the connection of the feedback signal. • Check the various PID-related parameter settings. • No PID feedback input to the terminal causes the value detected to be 0, causing a PID']","['Occurs When Running at a Constant Speed Cause Possible Solutions Excessive load inertia in Open Loop Vector Control.• Loads with a lot of inertia (fans, etc.) can trigger an overvoltage fault when operating in Open Loop Vector Control. • Switch to the V/f motor control method. • Adjust the values set for the speed feedback detection control time constant (n2-02, n2-03). nMotor Stalls During Acceleration or With Large Loads Cause Possible Solutions Load is too heavy.Take the following steps to resolve the problem: •Reduce the load. • Increase the acceleration time. • Increase motor capacity. • Although the drive has a Stall Prevention function and a Torque Compensation Limit function, accelerating too quickly or trying to drive an excessively large load can exceed the capabilities of the motor. nMotor Will Not Accelerate or the Acceleration Time is Too Long Cause Possible Solutions Frequency reference is too low.• Check the maximum output frequency (E1-04). •Increase E1-04 if it is set too low. Check U1-01 for proper frequency reference. Check if a frequency reference signal switch has been set to one of the multi-function input terminals. Check for low gain level set to terminals A1 or A2 (H3-03, H3-11). Load is too heavy.• Reduce the load so that the output current remains within the motor-rated current. • In extruder and mixer applications, the load will sometimes increase as the temperature drops. Check if the mechanical brake is fully releasing as it should. The torque']","['to stop while in Open Loop Vector Control. Cause Possible Solution Motor parameters are not set properly. Check the motor parameter settings and repeat Auto-Tuning. Torque limit is too low. Set the torque limit to the most appropriate setting (L7-01 through L7-04). Load inertia is too big.• Adjust the deceleration time (C1-02, -04, -06, -08). •Set the frequency to the minimum value and interrupt the run command when the drive finishes decelerating. Digital Operator Display Fault Name CoFCurrent Offset Fault The current sensor is damaged or there was residual induction current in the motor (e.g., during sudden deceleration or when coasting) when the drive attempted to start the motor. Cause Possible Solution6.4 Fault Detection YASKAWA ELECTRIC SIEP C710606 18F YASKAWA AC Drive – V1000 Technical Manual 2676TroubleshootingDigital Operator Display Fault Name Due to residual induction current in the motor when the drive attempted to start the motor, the drive attempted to adjust the current offset value beyond the allowable range.• Create a motor restart sequence that allows enough time for the residual induction voltage to dissipate. • Enable Speed Search at start (b3-01 = 1). Use the multi-function terminals to execute External Speed Search 1 and 2 (H1-oo = 61 or 62). Note: When using a PM motor, both External Speed Search 1 and 2 perform the same operation. Digital Operator Display Fault Name CPF02A/D Conversion Error An A/D conversion error occurred. Cause Possible Solution']","['the same as the resonant frequency of the connected machinery.• Adjust the parameters used for the Jump Frequency function (d3-01 through d3-04) to skip the problem-causing bandwidth. • Place the motor on a rubber pad to reduce vibration. Note: The drive may have trouble assessing the status of the load due to white noise generated when using Swing PWM (C6-02 = 7 to A).6.9 Troubleshooting without Fault Display YASKAWA ELECTRIC SIEP C710606 18F YASKAWA AC Drive – V1000 Technical Manual 3056TroubleshootingnOscillation or Hunting Cause Possible Solutions Insufficient tuning in Open Loop Vector ControlAdjust the following parameters in the order listed. An increase in gain should be followed with an increase in the primary delay time constant. •C4-02 (Torque Compensation Primary Delay Time) • n2-01 (Speed Feedback Detection Control [AFR] Time Constant 1) • C3-02 (Slip Compensation Primary Delay Time) The response for torque compensation and slip compensation will drop as the time constant is increased. Auto-Tuning has not yet been performed (required for Open Loop Vector Control).Perform Auto-Tuning. Set motor parameters after calculating the proper values. Change the motor control method to V/f Control ( A1-02 = “0”). Insufficient tuning in V/f Control.Reduce the gain. •n1-02 (Hunting Prevention Gain Setting) • n1-03 (Hunting Prevention Time Constant Setting) Gain is too low when using PID control. Check the period of oscillation and adjust P, I, and D settings accordingly. The']"
31,['How do you reset the password for the V1000?'],['Performing a 2-Wire or 3-Wire initialization resets the password to ‘0000’.'],['A1-04 Enter the Password to Unlock Parameters'],"['time. A1-05 will appear. Note: A1-05 is normally hidden, but can be displayed by following the directions listed here.“05” flashes 7.Press the key. 8.Use , and to enter the password. 9.Press to save what was entered. 10. The display automatically returns to the display shown in step 5. Table 5.3 Check to see if A1-01 is locked (continuing from step 10 above) Step Display/Result 1.Press to display A1-01.“01” flashes 2.Press to display the value set to A1-01. 3.Press and , making sure that the setting values cannot be changed. 4.Press to return to the first display.5.1 A: Initialization 118 YASKAWA ELECTRIC SIEP C710606 18F YASKAWA AC Drive – V1000 Technical ManualTable 5.4 Enter the Password to Unlock Parameters (continuing from step 4 above) Step Display/Result 1.Press to enter the parameter setup display. 2.Press to select the flashing digits as shown.“01” flashes 3.Press to scroll to A1-04. 4. Enter the password “1234”. 5.Press to save the new password. 6. Drive returns to the parameter display. 7.Press and scroll to A1-01. 8. Press to display the value set to A1-01. If the first ""0"" blinks, parameter settings are unlocked. 9.Use and to change the value if desired. This is not typical. 10. Press to save the setting, or to return to the previous display without saving changes. 11. The display automatically returns to the parameter display. Note: Parameter settings can be edited after entering the correct password. Performing a 2-Wire or 3-Wire initialization resets the']","['ov................................................................ 264, 265, 277, 288 Overcurrent ................................................................ 264, 272 Overexcitation Deceleration Gain ............................................ 392 Overexcitation Operation Selection .......................................... 392 Overheat 1 (Heatsink Overheat) .............................................. 274 Overheat Alarm Level .......................................................... 389 Overheat Pre-Alarm Operation Selection ................................... 390 Overload oL1 (oL1 Alarm) .................................................... 380 Overload Tolerance ........................................... 343, 344, 345, 346 Overspeed (for Simple V/f with PG) ............................. 264, 265, 288 Overspeed (Simple V/f with PG) ............................................. 277 Overtorque/Undertorque Detection Level ................................... 381 Overtorque 1 ............................................................... 265, 287 Overtorque 2 ............................................................... 265, 287 Overtorque Detection 1 .................................................. 264, 276 Overtorque Detection 2 .................................................. 264, 276 Overvoltage .......................................................... 264, 265, 277Index 504 YASKAWA ELECTRIC SIEP C710606 18F YASKAWA AC Drive – V1000 Technical']","['to A1-04. 4. Enter the password “1234”. 5.Press to save the new password. 6. Drive returns to the parameter display. 7.Press and scroll to A1-01. 8. Press to display the value set to A1-01. If the first ""0"" blinks, parameter settings are unlocked. 9.Use and to change the value if desired. This is not typical. 10. Press to save the setting, or to return to the previous display without saving changes. 11. The display automatically returns to the parameter display. Note: Parameter settings can be edited after entering the correct password. Performing a 2-Wire or 3-Wire initialization resets the password to “0000”. Reenter the password to parameter A1-05 after drive initialization. nA1-06: Application Presets Several Application Presets are available to facilitate drive setup for commonly used applications. Selecting one of these Application Presets automatically sets the required parameters to default values and selects I/Os. In addition, Application Preset parameters are assigned to the list of User Parameters, A2-01 through A2-16. These can be accessed in the Setup Mode and provide quicker application adjustment by eliminating the need to scroll through multiple menus. Refer to Application Selection on page 96 for details on parameter A1-06. nA1-07: DriveWorksEZ Function Selection DriveWorksEZ is a software package that can be used to customize the drive functionality or add PLC functionality by the interconnection and configuration of basic software function blocks. The']","['password. If you cannot remember the password: • Display parameter A1-04. Press the STOP button while pressing at the same time. Parameter A1-05 will appear. •Set a new password to parameter A1-05. Undervoltage was detected.• Check the drive input power voltage by looking at the DC bus voltage (U1-07). •Check all main circuit wiring. uMotor Does Not Rotate Properly after Pressing RUN Button or after Entering External Run Command nMotor Does Not Rotate Cause Possible Solutions The drive is not in the Drive Mode.• Check if the DRV light on the LED operator is lit. •Enter the Drive Mode to begin operating the motor. Refer to The Drive and Programming Modes on page 84 . The button was pushed.Stop the drive and check if the correct frequency reference source is selected. If the operator keypad shall be the source, the LO/RE button LED must be on, if the source is REMOTE, it must be off. Take the following steps to solve the problem: • Push the button. •If o2-01 is set to 0, then the LO/RE button will be disabled. Auto-Tuning has just completed.• When Auto-Tuning has completed, the drive is switched back to the Programming Mode. The Run command will not be accepted unless the drive is in the Drive Mode. • Use the LED operator to enter the Drive Mode. Refer to The Drive and Programming Modes on page 84. A Fast-Stop was executed and has not yet been reset. Reset the Fast-Stop command. Settings are incorrect for the source that provides the run command.Check parameter b1-02 (Run']"
