,Question,Answer,Source,Context_1,Context_2,Context_3,Context_4
8,['Which parameter is used to adjust the input voltage reference?'],['H3-09'],['Main Frequency Reference uDIP Switch S1 Analog Input Signal Selection'],"['Manual 693Electrical Installation3.9 Main Frequency Reference uDIP Switch S1 Analog Input Signal Selection The main frequency reference can either be a voltage or current signal input. For voltage signals both analog inputs, A1 and A2, can be used, for current signals A2 must be used. When using input A2 as a voltage input, set DIP switch S1 to “V” (left position) and program parameter H3-09 to “0” (0 to +10 Vdc with lower limit) or “1” (0 to +10 Vdc without lower limit). To use current input at terminal A2, set the DIP switch S1 to ""I"" (default setting) and set parameter H3-09 = “2” or “3” (4-20 mA or 0-20 mA). Set parameter H3-10 = “0” (frequency reference). Note: If Terminals A1 and A2 are both set for frequency reference (H3-02 = 0 and H3-10 = 0), the addition of both input values builds the frequency reference. Table 3.12 Frequency Reference Configurations Voltage Input Current Input Drive Main speed frequency reference (voltage input) Main speed frequency reference (current input) Frequency referencecommon+10.5 V20 mA current 0 to 10 V+V A1 A2 ACDrive Main speed frequency reference (voltage input) Main speed frequency reference (current input) Frequency referencecommon4 to 20 mA input or 0 to 20 mA input+10.5 V 20 mA current+V A1 A2 AC V I Figure 3.26 DIP Switch S1 Table 3.13 DIP Switch S1 Settings Setting Value Description V (left position) Voltage input (0 to 10 V) I (right position) Current input (4 to 20 mA or 0 to 20 mA): default setting Table 3.14 Parameter H3-09']","['change or apply these settings. Setting 41: Output Voltage Gain Allows the user to change the output voltage by adjusting the voltage reference via one of the analog input terminals or with MEMOBUS/Modbus. An internal 0.3 second delay has been added to prevent sudden, drastic change to the V/f pattern. Note: When an input terminal is assigned to adjust the Output Voltage Gain (H3- oo = 41), a voltage reference from MEMOBUS/Modbus is ignored. nH3-14: Analog Input Terminal Enable Selection Note: Parameter available in drive software versions PRG: 1016 and later. Determines which of the analog input terminals will be enabled or disabled when a digital input programmed for “Analog input enable” (H1- oo = C) is closed. When H1- oo ≠ C, all of the input terminals are enabled all of the time. Terminals not set as the target are not influenced by input signals. No. Name Setting Range Default H3-14 Analog Input Terminal Enable Selection 1, 2, 7 7 Setting 1: Terminal A1 only Setting 2: Terminal A2 only Setting 7: All Terminals Enabled nH3-16/H3-17: Terminal A1/A2 Offset Note: Parameters available in drive software versions PRG: 1016 and later. Determines the amount of offset to be used to calibrate analog input signals from the terminals A1 and A2.5.7 H: Terminal Functions YASKAWA ELECTRIC SIEP C710606 18F YASKAWA AC Drive – V1000 Technical Manual 2095Parameter DetailsEnter a 0 V signal to terminal A1. Next adjust the offset in H3-16 until the monitor U1-13 for the terminal A1 input']","['is applicable only if the frequency reference is set by an analog or pulse input. No. Parameter Name Setting Range Default d4-07 Analog Frequency Reference Fluctuation Limit 0.1 to 100.0% 1.0% nd4-08: Frequency Reference Bias Upper Limit (Up/Down 2) Parameter d4-08 sets the upper limit of the Up/Down 2 bias (monitor U6-20) and the value that can be saved in parameter d4-06. Set this parameter to an appropriate value before using the Up/Down 2 function. Note: When the frequency reference is set by the digital operator (b1-01 = 0) and d4-01 = 1, the bias value will be added to the frequency reference if no Up/Down 2 command is received for 5 s, and will be reset to 0 afterwards. From that point the bias can be increased up to the limit set in d4-08 again.5.4 d: Reference Settings 166 YASKAWA ELECTRIC SIEP C710606 18F YASKAWA AC Drive – V1000 Technical ManualNo. Parameter Name Setting Range Default d4-08 Frequency Reference Bias Upper Limit 0.0 to 100.0%<1> <1> Default setting is determined by the software version. PRG: 1016 and later: 100.00% PRG: 1015 and earlier: 0.00% nd4-09: Frequency Reference Bias Lower Limit (Up/Down 2) Parameter d4-08 sets the lower limit of the Up/Down 2 bias (monitor U6-20) and the value that can be saved in parameter d4-06. Set this parameter to an appropriate value before using the Up/Down 2 function. Note: When the frequency reference is set by the digital operator (b1-01 = 0) and d4-01 = 1, the bias value will be added to the frequency reference']","['Bias Operation Mode Selection (Up/Down 2) Determines if the bias value is held or not when the Up/Down 2 inputs are both released or both enabled. The parameter is effective only when parameter d4-03 is set to 0.00. No. Parameter Name Setting Range Default d4-05 Frequency Reference Bias Operation Mode Selection 0 or 1 0 Setting 0: Hold Bias Value The bias value will be held if no input Up 2 or Down 2 is active. Setting 1: Reset Bias Value The bias is reset to 0% when both inputs Up 2 and Down 2 are either on or off. The drive will use the accel/decel time as selected in d4-04 to accelerate or decelerate to the frequency reference value. nd4-06: Frequency Reference Bias (Up/Down 2) This parameter is used to save the frequency reference bias value set by the Up/Down 2 function. It is set as a percentage of the maximum output frequency. The function of d4-06 depends on how the Up/Down 2 function is configured. • This parameter is not normally used when the frequency reference is set by the digital operator. The user can set d4-06 to a certain value that will be applied when the operation is started, but it will be reset when the frequency reference changes (including multi-step references) or will be disabled when d4-01 = 0 and the Run command is removed. • When d4-01 = 0 and the frequency reference is set by an analog or pulse input, the value set in d4-06 is generally added to or subtracted from the frequency reference. • When d4-01 = 1 and the frequency reference is set by a']"
9,['How do you initiate Auto-Tuning for the V1000?'],['Turn on the power to the drive. Press the key until the Auto-Tuning display appears. Press to begin setting parameters.'],"['4.7 Auto-Tuning, Set the Selected Type of Auto-Tuning']","['AC Drive – V1000 Technical Manual 1054Start-Up Programming & OperationNOTICE: Never perform Rotational Auto-Tuning for a motor connected to a load. Failure to comply could result in improper drive operation. If Rotational Auto-Tuning is performed for a motor coupled to a load, the motor parameters will be inaccurate and the motor may exhibit abnormal operation. Disconnect or decouple the motor from the load. Enter the required information from the motor nameplate. Press to proceed to the Auto-Tuning start display. Note: These instructions continue from Step 7 in “Enter Data from the Motor Nameplate”. Step Display/Result 1.After setting T1-07 as illustrated in the previous section, press and confirm the display is as described below: 2.Press to activate Auto-Tuning. flashes. Note: The first digit indicates which motor is undergoing Auto-Tuning (motor 1 or motor 2). The second digit indicates the type of Auto-Tuning being performed. 3.Auto-Tuning finishes in approximately one to two minutes. uInput Data for Auto-Tuning The T1-oo parameters are used to set the Auto-Tuning input data. Note: 1.Cycling power to the drive will reset any values set during the Auto-Tuning process to factory defaults. 2.For motors that are to be operated in the field weakening range, first perform the Auto-Tuning with the base data, i.e. the frequency at which the motor is operating with its rated voltage (base frequency). After Auto-Tuning is complete, change the maximum frequency E1-04 to the']","['adjust PID target and feedback signal scaling. Reverse drive output frequency and speed detection. When output frequency rises, the sensor detects a speed decrease.Set PID output for reverse characteristics (b5-09 = “1”). nInsufficient Motor Torque Cause Possible Solutions Auto-Tuning has not yet been performed (required for OLV Control).Perform Auto-Tuning. The control mode was changed after performing Auto- Tuning.Perform Auto-Tuning again. Only Line-to-Line Resistance Auto-Tuning was performed.Perform Rotational Auto-Tuning. nMotor Rotates After the Drive Output is Shut Off Cause Possible Solutions Low DC Injection Braking and the drive cannot decelerate properly.• Adjust the DC Injection braking settings. •Increase the value of b2-02 (DC Injection Braking Current). • Increase the b2-04 (DC Injection Braking Time at Stop).6.9 Troubleshooting without Fault Display 306 YASKAWA ELECTRIC SIEP C710606 18F YASKAWA AC Drive – V1000 Technical Manualnov or Speed Loss Occurs When Starting into a Rotating Load Cause Possible Solutions The load is already rotating when the drive is trying to start it.• Stop the motor using DC Injection braking. Restart the motor. •Increase the value of b2-03 (DC Injection Braking Time at start). • Enable Speed Search at start (b3-01 = “1”). •Set a multi-function input terminal for external Speed Search command (H1- oo=“61” or “62” during restart). nOutput Frequency is not as High as Frequency Reference Cause Possible Solutions Frequency reference is']","['Time) The response for torque compensation and slip compensation will drop as the time constant is increased. Auto-Tuning has not yet been performed (required for Open Loop Vector Control).Perform Auto-Tuning. Set motor parameters after calculating the proper values. Change the motor control method to V/f Control ( A1-02 = “0”). Insufficient tuning in V/f Control.Reduce the gain. •n1-02 (Hunting Prevention Gain Setting) • n1-03 (Hunting Prevention Time Constant Setting) Gain is too low when using PID control. Check the period of oscillation and adjust P, I, and D settings accordingly. The frequency reference is assigned to an external source and the signal is noisy.• Ensure that noise is not affecting the signal lines. •Separate main circuit wiring and control circuit wiring. • Use twisted-pair cables or shielded wiring for the control circuit. • Increase the analog input time filter constant (H3-13). The cable between the drive and motor is too long.• Perform Auto-Tuning. •Reduce the length of the cable. nPID Output Fault Cause Possible Solutions No PID feedback input.• Check the multi-function analog input terminal settings. • Set multi-function analog input terminal A1 or A2 for PID feedback (H3-02 or H3-10 = “B”). • A signal input to the terminal selection for PID feedback is necessary. • Check the connection of the feedback signal. • Check the various PID-related parameter settings. • No PID feedback input to the terminal causes the value detected to be 0, causing a PID']","['data. 5.Start the Auto-Tuning process when prompted by the drive. 6.If Auto-Tuning was successfully performed, do a test run without the load and make any necessary parameter adjustments. 7.If the test run was successful, do a test run with the load connected and make parameter adjustments if necessary.4.7 Auto-Tuning 104 YASKAWA ELECTRIC SIEP C710606 18F YASKAWA AC Drive – V1000 Technical ManualuAuto-Tuning Example The following example illustrates how to perform Rotational Auto-Tuning for Open Loop Vector Control (A1-02 = 2). nSet the Selected Type of Auto-Tuning Step Display/Result 1.Turn on the power to the drive. The initial display appears. 2.Press the key until the Auto-Tuning display appears. 3.Press to begin setting parameters. 4.Press to display the value for T1-01. 5.Press to select the digit to edit. 6.Press and set the drive to perform Rotational Auto-Tuning (00). 7.Save the setting by pressing . 8.The display automatically returns to the display shown in Step 3. nEnter Data from the Motor Nameplate After selecting the type of Auto-Tuning, enter the data required from the motor nameplate. Note: These instructions continue from Step 8 in “Set the Selected Type of Auto-Tuning”. Step Display/Result 1.Press to access the motor output power parameter T1-02. 2.Press to view the default setting. 3.Press to select the digit to edit. 4.Press and enter the motor power nameplate data in kW. 5.Press to save the setting. 6.The display automatically returns to the display in']"
10,['What should be done if the motor stalls during acceleration?'],"['Reduce the load, Increase the acceleration time, Increase motor capacity']",['nMotor Stalls During Acceleration or With Large Loads Cause Possible Solutions'],"['too high or acceleration and deceleration times are too short, the motor may be unable to keep up with the frequency reference, resulting in excessive slip. This “stalling” makes it impossible to decelerate or accelerate. The drive can prevent the motor from stalling and still reach the desired speed without the user needing to change the acceleration or deceleration time settings. The Stall Prevention function can be set separately for acceleration, operating at constant speeds, and deceleration. nL3-01: Stall Prevention Selection during Acceleration Stall Prevention during acceleration is used when the motor loses speed during acceleration due to a relatively large load. It prevents overcurrent and motor overload (oL1) from occurring. This parameter sets the Stall Prevention method for acceleration. No. Name Setting Range Default L3-01 Stall Prevention Selection during Acceleration 0 to 2 <1> 1 <1> Setting 2 is not available for PM OLV. Setting 0: Disabled No Stall Prevention is provided. If the acceleration time setting is too short, the drive may not be able to accelerate within the set time and the motor may stall. Setting 1: Enabled Enables Stall Prevention during acceleration. The operation depends on the selected control mode. • V/f or Open Loop Vector Control: When the output current exceeds 85% of the level set in parameter L3-02, the acceleration rate is reduced. The acceleration is stopped when the current exceeds L3-02. Acceleration continues when the current']","['Occurs When Running at a Constant Speed Cause Possible Solutions Excessive load inertia in Open Loop Vector Control.• Loads with a lot of inertia (fans, etc.) can trigger an overvoltage fault when operating in Open Loop Vector Control. • Switch to the V/f motor control method. • Adjust the values set for the speed feedback detection control time constant (n2-02, n2-03). nMotor Stalls During Acceleration or With Large Loads Cause Possible Solutions Load is too heavy.Take the following steps to resolve the problem: •Reduce the load. • Increase the acceleration time. • Increase motor capacity. • Although the drive has a Stall Prevention function and a Torque Compensation Limit function, accelerating too quickly or trying to drive an excessively large load can exceed the capabilities of the motor. nMotor Will Not Accelerate or the Acceleration Time is Too Long Cause Possible Solutions Frequency reference is too low.• Check the maximum output frequency (E1-04). •Increase E1-04 if it is set too low. Check U1-01 for proper frequency reference. Check if a frequency reference signal switch has been set to one of the multi-function input terminals. Check for low gain level set to terminals A1 or A2 (H3-03, H3-11). Load is too heavy.• Reduce the load so that the output current remains within the motor-rated current. • In extruder and mixer applications, the load will sometimes increase as the temperature drops. Check if the mechanical brake is fully releasing as it should. The torque']","['(L3-04 = 4) by increasing the amount of overexcitation current applied to the motor. Note: When operation permits, use normal Overexcitation Deceleration (L3-04 = 4). nL3-05: Stall Prevention Selection During Run Stall Prevention During Run can prevent a motor from stalling by automatically reducing the speed when a transient overload occurs while the motor is running at constant speed. This parameter selects the Stall Prevention During Run method. No. Name Setting Range Default L3-05 Stall Prevention Selection During Run 0 to 2 1 Note: 1. This function is not available in Open Loop Vector Control. Use the torque limit function instead. 2.When output frequency is 6 Hz or less, Stall Prevention During Run is disabled regardless of the setting in L3-05/06.5.8 L: Protection Functions 224 YASKAWA ELECTRIC SIEP C710606 18F YASKAWA AC Drive – V1000 Technical ManualSetting 0: Disabled Drive runs at the set frequency reference. A heavy load may cause the motor to stall and trip the drive with an oC or oL fault. Setting 1: Decelerate Using C1-02 If the current exceeds the Stall Prevention level set in parameter L3-06, the drive decelerates at Decel Time 1 (C1-02). Once the current level drops below the value of L3-06 minus 2% for 100 ms it accelerates back to the frequency reference at the active acceleration time. Setting 2: Decelerate Using C1-04 Same as setting 1 except the drive decelerates at decel time 2 (C1-04). nL3-06: Stall Prevention Level During Run Sets the current level']","['to stop while in Open Loop Vector Control. Cause Possible Solution Motor parameters are not set properly. Check the motor parameter settings and repeat Auto-Tuning. Torque limit is too low. Set the torque limit to the most appropriate setting (L7-01 through L7-04). Load inertia is too big.• Adjust the deceleration time (C1-02, -04, -06, -08). •Set the frequency to the minimum value and interrupt the run command when the drive finishes decelerating. Digital Operator Display Fault Name CoFCurrent Offset Fault The current sensor is damaged or there was residual induction current in the motor (e.g., during sudden deceleration or when coasting) when the drive attempted to start the motor. Cause Possible Solution6.4 Fault Detection YASKAWA ELECTRIC SIEP C710606 18F YASKAWA AC Drive – V1000 Technical Manual 2676TroubleshootingDigital Operator Display Fault Name Due to residual induction current in the motor when the drive attempted to start the motor, the drive attempted to adjust the current offset value beyond the allowable range.• Create a motor restart sequence that allows enough time for the residual induction voltage to dissipate. • Enable Speed Search at start (b3-01 = 1). Use the multi-function terminals to execute External Speed Search 1 and 2 (H1-oo = 61 or 62). Note: When using a PM motor, both External Speed Search 1 and 2 perform the same operation. Digital Operator Display Fault Name CPF02A/D Conversion Error An A/D conversion error occurred. Cause Possible Solution']"
11,['What does the LO/RE key control in the V1000?'],['Switch between LOCAL and REMOTE operation'],"['4.3 The Drive and Programming Modes, 2.The drive will not allow the user to switch between LOCAL and REMOTE during run.']","['ov................................................................ 264, 265, 277, 288 Overcurrent ................................................................ 264, 272 Overexcitation Deceleration Gain ............................................ 392 Overexcitation Operation Selection .......................................... 392 Overheat 1 (Heatsink Overheat) .............................................. 274 Overheat Alarm Level .......................................................... 389 Overheat Pre-Alarm Operation Selection ................................... 390 Overload oL1 (oL1 Alarm) .................................................... 380 Overload Tolerance ........................................... 343, 344, 345, 346 Overspeed (for Simple V/f with PG) ............................. 264, 265, 288 Overspeed (Simple V/f with PG) ............................................. 277 Overtorque/Undertorque Detection Level ................................... 381 Overtorque 1 ............................................................... 265, 287 Overtorque 2 ............................................................... 265, 287 Overtorque Detection 1 .................................................. 264, 276 Overtorque Detection 2 .................................................. 264, 276 Overvoltage .......................................................... 264, 265, 277Index 504 YASKAWA ELECTRIC SIEP C710606 18F YASKAWA AC Drive – V1000 Technical']",['3.4 4A0005 2.2 5.4 1.5 4.8 4A0007 3.0 6.9 2.2 5.5 4A0009 3.7 8.8 3.0 7.2 4A0011 5.5 11.1 3.7 9.2 4A0018 7.5 17.5 5.5 14.8 4A0023 11 23.0 7.5 18.0 4A0031 15 31.0 11 24.0 4A0038 18.5 38.0 15 31.0 Note: Refer to Component Names on page 28 for differences regarding enclosure protection types and component descriptions.1.2 Model Number and Nameplate Check 26 YASKAWA ELECTRIC SIEP C710606 18F YASKAWA AC Drive – V1000 Technical Manual1.3 Drive Models and Enclosure Types The following table describes drive enclosures and models. Table 1.1 Drive Models and Enclosure Types Voltage ClassEnclosure Type IP20/Open-Chassis Drive ModelIP00/Open-Chassis Drive ModelIP20/NEMA Type 1 Drive Model Single-Phase 200 V ClassBA0001B – BA0001F BA0002B – BA0002F BA0003B – BA0003F BA0006B – BA0006F BA0010B – BA0010F BA0012B – BA0012F BA0018B – BA0018F Three-Phase 200 V Class2A0001B – 2A0001F 2A0002B – 2A0002F 2A0004B – 2A0004F 2A0006B – 2A0006F 2A0010B – 2A0010F 2A0012B – 2A0012F 2A0020B – 2A0020F – 2A0030A 2A0030F – 2A0040A 2A0040F – 2A0056A 2A0056F – 2A0069A 2A0069F Three-Phase 400 V Class4A0001B – 4A0001F 4A0002B – 4A0002F 4A0004B – 4A0004F 4A0005B – 4A0005F 4A0007B – 4A0007F 4A0009B – 4A0009F 4A0011B – 4A0011F – 4A0018A 4A0018F – 4A0023A 4A0023F – 4A0031A 4A0031F – 4A0038A 4A0038F Two types of enclosures are offered for V1000 drives. •IP20/Open-Chassis and IP00/Open-Chassis models are often placed inside a large enclosure panel where the front of the drive is covered to prevent someone from'],"['the proper inspections to perform after receiving the drive and illustrates the different enclosure types and components. 1.1 SECTION SAFETY ................................................................................................. 24 1.2 MODEL NUMBER AND NAMEPLATE CHECK .................................................... 25 1.3 DRIVE MODELS AND ENCLOSURE TYPES........................................................27 1.4 COMPONENT NAMES ........................................................................................... 281 YASKAWA ELECTRIC SIEP C710606 18F YASKAWA AC Drive – V1000 Technical Manual 231.1 Section Safety CAUTION Do not carry the drive by the front cover. Failure to comply may cause the main body of the drive to fall, resulting in minor or moderate injury. NOTICE Observe proper electrostatic discharge procedures (ESD) when handling the drive and circuit boards. Failure to comply may result in ESD damage to the drive circuitry. A motor connected to a PWM drive may operate at a higher temperature than a utility-fed motor and the operating speed range may reduce motor cooling capacity. Ensure that the motor is suitable for drive duty and/or the motor service factor is adequate to accommodate the additional heating with the intended operating conditions.1.1 Section Safety 24 YASKAWA ELECTRIC SIEP C710606 18F YASKAWA AC Drive – V1000 Technical Manual1.2 Model Number and Nameplate Check Please perform the following tasks after receiving the drive:']","['original default settings. Scroll through the list by pressing the key. 4.Press the key until C1-01 appears. 5.Press the key to access the setting value. (number farthest to the left flashes) uSwitching Between LOCAL and REMOTE Entering the run command using the LED operator is referred to as LOCAL, while entering the run command from an external device via the control circuit terminals or network option is referred to as REMOTE. WARNING! Sudden Movement Hazard. The drive may start unexpectedly if the Run command is already applied when switching from LOCAL mode to REMOTE mode when b1-07 = 1, resulting in death or serious injury. Be sure all personnel are clear of rotating machinery and electrical connections prior to switching between LOCAL mode and REMOTE mode. There are two ways to switch between LOCAL and REMOTE. Note: 1. After selecting LOCAL, the LO/RE light will remain lit.4.3 The Drive and Programming Modes 88 YASKAWA ELECTRIC SIEP C710606 18F YASKAWA AC Drive – V1000 Technical Manual2.The drive will not allow the user to switch between LOCAL and REMOTE during run. nUsing the LO/RE Key on the LED Operator Step Display/Result 1.Turn on the power to the drive. The initial display appears. 2.Press . The LO/RE light will light up. The drive is now in Local. To set the drive for REMOTE operation, press the key again.STOP nUsing Input Terminals S1 through S7 to Switch between LO/RE Switch between LOCAL and REMOTE using one of the digital input terminals S1 through S7 (set']"
